text_title;sentence_number;include;preceding_word;preceding_word_pos;preceding_word_morph;preceding_word_gls;borrowing;verb;verb_morph;verb_gls;sentence;sentence_gls;sentence_trsl;semantic_field;;;;;;;;;;;;
20230114-SidiqAkberShopKeparWithHabibShah;115;yes;raːbita;n;raːbita;contact;Ar;keidaːum;ke-idaːum;do-dist.pst.1sg;nori raːbita ke-idaːum tasa manzi;now contact(?) do-dist.pst.1sg dist.obl.sg with/at;i had contacted now;19;;;;;;;;;;;;
20220124-SadaatVisitAkroiToArandugole;30;yes;sat;n;sat;invite;;keus;ke-us;do.pst.3sg;ʥo tasa manzi milaːu bok milaːu bok-ãː ʥamaːid-a niɕ-i teni aːisaː maːisaː ʥa-us ʥo giri ʨai-n-i sat ke-us;dist.obl.sg with/at met be.pst.1pl met be.pst.1pl-dat mosque-obl sit-cv welcome m-redupl say-pst.3sg then tea-gen-f do.invite-pst.3sg;So when we met him, we were in the mosque, then he invited us for tea.;19;;;;;;;;;;;;
20220124-SadaatVisitAkroiToArandugole;31;yes;sat;n;sat;invite;;keusãː;ke-us-ãː;do.pst.3sg-dat;ʨai-an-i sat ke-us-ãː amaj ʥa-ua ʨai xo ama tu ɬ-imes xo ama endaːmi tar-imek;tea-gen-f do.invite-pst.3sg-dat we.erg say-pst.3m.sg tea we.obl you.sg give-prs.2sg but we further(?) swim-prs.1pl;When they invited us for tea, we accepted and told them that we will pass through here and go further.;19;;;;;;;;;;;;
20211107-GulLifeStory;115;no;maɕxultiaː;n;maɕxultiaː;hobby(?);Ar;kewo;ke-wo;do-pst.2pl;woj men-a bak-an-a manana ʨi ʥ-i mo manzi maɕxultiaː ke-wo;prox.sg your.pl-m side-gen-m that come-cv I.obl with/at hobby(?) do-pst.2pl;Thank you for coming here and engaging with me;;;;;;;;;;;;;
20220718-QaderAndBabarConversation;7;no;maɕxultiaː;n;maɕxultiaː;hobby(?);Ar;kerimet;ker-imet;do-prs.3pl;au ime du-mi taːnu manzi maɕxultiaː ker-imet ama asun-a asu maɕxultiaː jak wiɖiu rikaːrɖiŋg-a ki band ker-imek;and prox.pl two-collect self's with/at hobby(?) do-prs.3pl we prox.gen.sg-m prox.obl.pl hobby(?) one video recording-obl to closed do-prs.1pl;These two will have a conversation and we will video it;;;;;;;;;;;;;
20230507-ConversationBetweenTwoStudentEmanAndAfradKhan;9;no;maɕxultiaː;n;maɕxultiaː;hobby(?);Ar;kereta;ker-eta;do-fut.3pl;maɕxultiaː ker-eta ime du-mi zu gil;hobby(?) do-fut.3pl prox.pl two-collect girl pl;they will talk among themselves;;;;;;;;;;;;;
20230521-GirlsDiscussionAboutGeneralChatting;232;no;maɕxultiaː;n;maɕxultiaː;hobby(?);Ar;kemaːn;ke-maːn;do-ptcp.ipf;ate aːma-a niʂ-i taːnu maɕxultiaː ke-maːn bot;here house-obl sit-cv self's hobby(?) do-ptcp.ipf be.pst.3pl;were chatting while sitting at home;;;;;;;;;;;;;
20230409-GulMuhammadTalkingAboutMeyaMosque;107;no;ʨʰuʈi;n;ʨʰuʈi;holiday;Ur;kemaːn;ke-maːn;do-prs.3sg;giri zaːtak iskul d-imet woj ʨʰuʈi ke-maːn;then young.people school go-prs.3pl prox.sg holiday do-prs.3sg;then he send the children to leave and children went to school;;;;;;;;;;;;;
20220124-SadaatVisitAkroiToArandugole;116;yes;kʰud;nf;kʰud;question;;ke;ke;do.cv;ʥo teni ʥa-us ʨi gawar taːnu ɕai-an-a kʰud ke na-ba-met;dist.erg.sg say-pst.3sg that Gawar self's thing-gen-m question do.cv neg-can-prs.3pl;He told us where the Guar people could ask for their rights;18;;;;;;;;;;;;
20151225-DinMuhammadFolkTale;96.1;;izat;nf;izat;honour;Ar;kejiki;ke-jik-i;do-vn;tãː ʂabaʂau ɕil-i izat tasan-i aman-i ʥaːj-an-i zu tʰɪni ʥa-i ama ta sasi naʂʈa bi en ɬi nes-ok ʥa-i law tasan-i izat ke-jik-i bot;you.sg.dat such-f honour dist.gen.sg-f our-f mother-gen-f daughter be.prs.3f.sg say-cv we sister add prox.erg/ins by come.out-pst.1pl say-cv very dist.gen.sg-f honour do-vn be.pst.3pl;The mother found her daughter, for whom she had become homeless, they respected her;;;;;;;;;;;;;
20151225-DinMuhammadFolkTale;187;;izat;nf;izat;honour;Ar;keiki;ke-ik-i;do-vn;aːma gaː-us aːma gaː-i tasu niʂa-i ʨai ɬ-itus miʂʈi ɬ-itus wagli ker-us ʥo tasun-i law qadar izat ke-ik-i bua;house carry-pst.3sg house carry-cv dist.obl.pl sit.caus-cv tea give-prf.3sg bread give-prf.3sg thing do-pst.3sg dist.gen.pl-f very value(?) honour do-vn be.pst.3m.sg;The king showed good hospitality to them.;;;;;;;;;;;;;
20151225-DinMuhammadFolkTale;216;;izat;nf;izat;honour;Ar;keri;ker-i;do-cv;ama xo xudaːi abaːd-ãː kʰaː-us naː ʥa-i tasan-i law ʂobaːn-i izat ker-i tasa faːʈʂaː-an-i faːʈʂa-i ʥa-us ʨi ã d-imem patagrn;we God building-dat take.out-pst.3sg say-cv dist.gen.sg-f very beautiful-f honour do-cv dist.obl.sg king-gen-f king-erg/ins say-pst.3sg that I go-prs.1sg back;The king was well received and after some time the king left for his kingdom;;;;;;;;;;;;;
20220124-SadaatVisitAkroiToArandugole;76;yes;tajaːr;adj;tajaːr;ready;Ar;keua;ke-ua;do-pst.3m.sg;me pehlaː banda bo tobak mobaka amaj tajaːr ke-ua xo ten bliaːja-e ʥa-us ʨi e ime kara laːrawe tʰi-ta baːl-ika;you.pl first be.pst.2pl gun we.erg ready do-pst.3m.sg dist.erg.sg brother-erg/ins say-pst.3sg that prox.pl who passer-by be-fut.3pl look-fut.1pl;You are the first people. We prepared the gun and my brother told us at home that it will be a passer-by;20;;;;;;;;;;;;
20220124-SadaatVisitAkroiToArandugole;55;yes;baʨ;n;baʨ;save;Ur;keji;ke-ji;do.cv;allah e laka ama tine marg-an-a baʨ ke-ji laka ten naŋga-i maːla gaː-us;God erg/ins like we.obl there death-gen-m do.save-cv like dist.erg.sg throw-cv down carry-pst.3sg;Allah saved us from death and we continued our downward journey.;22;;;;;;;;;;;;
20220126-AfserStory;22;yes;kraːs;nm;kraːs;cross;Eng;ke;ke;do.cv;bas bliaːja ravaːn bok ravaːn bi ɕiki bas dargai-a kraːs ke au ten malakanɖ-an-a guʂa-e tar-ok-ãː tine ãː ʦʰaɽomlau sax ziaːt;okay brother moving be.pst.1pl moving add so okay Dargai-obl cross do.cv and dist.erg.sg Malakand-gen-m hole-erg/ins swim-pst.1pl-dat there I difficult more;Finally we left for Peshawar. When we crossed Malakand and reached Dargai, I finally got dizzy and had some vomits.;10;;;;;;;;;;;;
20220809-HabibUllahNaimJanAboutShoping;6;yes;mukaːlima;n;mukaːlim-a;conversation;Ur?;kereta;ker-eta;do-fut.3pl;ime du-mi taːnu manzi mukaːlim-a ker-eta;prox.pl two-collect self's with/at conversation(?)-obl do-fut.3pl;Both of them will be talking to each other.;18;;;;;;;;;;;;
20230507-ConversationBetweenPrincipalAndATeacher;328;yes;kanwarsaɕan;n;kanwarsaɕan;conversation;Eng;kemaːn;ke-maːn;do-ptcp.ipf;ʨi taːnu manzi jak ʥanral kanwarsaɕan ke-maːn bot;that self's with/at one general conversation do-ptcp.ipf be.pst.3pl;these two were commonly talking;18;;;;;;;;;;;;
20230507-ConversationBetweenQilaatKhanAndWarisha;22;no;aːma;nm;aːma;house;;ke;ke;do.cv;muʂ-aːwa-a ki aːma ke muʂ-aːwa;play-inf-obl per/at(?) house do.cv play-inf;yes in playing I like making houses and play;;;;;;;;;;;;;
20230507-ConversationBetweenQilaatKhanAndWarisha;37;no;aːmaː;nm;aːma-a;house-obl;;kemesaː;ke-mes-aː;do-prs.2sg-q;tu taːnu kaːm -a aːma-a ke-mes-aː;you.sg self's work(?) obl house-obl do-prs.2sg-q;did you do your work at home?;;;;;;;;;;;;;
20230514-ConversationBetweenZahairShahAndHabibUmer;52;no;aːmaː;nm;aːma-a;house-obl;;kemaːn;ke-maːn;do-prs.3sg;ton-a muzduri -a pena law ɬam taːnu aːma-a ke-maːn;your-m labor.work obl from very work self's house-obl do-prs.3sg;more then the labour they work at house;;;;;;;;;;;;;
20230519-GroupConversationBetweenSharifUllahBahramKhanSharhussanAndImtiazAhmad;222;no;aːmaː;nm;aːma-a;house-obl;;keik;ke-ik;do-vn;ʥamaːit na bui naː aːma-a ke-ik -a pena se aːma neɽ-a baj bua;mosque not be.pst.3f.sg house-obl do-vn obl from dist.sg house close.area-obl good be.pst.3m.sg;There was no mosque and it was better to pray at home;;;;;;;;;;;;;
20230507-ConversationBetweenPrincipalAndATeacher;203;no;bemaːrpursi;adj;bemaːr-pursi;ill;Per;kedaːonaː;ke-daːon-aː;do-dist.pst.3pl-q;tasan-a bemaːr-pursi ke-daːon-aː ustaːz-aːn -e tasan-a ʥaːibaːb -an-a ʈʰaːn d-ibot -aː;dist.gen.sg-m ill do-dist.pst.3pl-q teacher-pl erg/ins dist.gen.sg-m mother-father gen-m area go-dist.pst.3pl q;did the teachers went to see her condition?;;;;;;;;;;;;;
20220701-AbulHassanNahairSafai;59;no;naːʥaːiz;adj;naːʥaːiz;illegal(?);?;kemet;ke-met;do-prs.3pl;kara ʨi naːʥaːiz ke-met ba tasa pena bi kʰud ke-tiau e;who that illegal(?) do-prs.3pl irr dist.obl.sg from add question do;He who does wrong should also be asked.;;;;;;;;;;;;;
20220409-RafeezUllahDarsolQuran;13;no;ahmiat;n;ahmiat;importance;Ar;bajaːn kera;bajaːn ker-a;do.tell-imp.sg;ʨun-ki woj ramazaːnulmubaːrak-an-i maːsoi tʰini ramazaːnulmubaːrak-an-i ki saːda alfaːz-e asan-i ahmiat bajaːn ker-a;because(?) prox.sg Ramadan-gen-f month be.prs.3f.sg Ramadan-gen-f simple word-erg/ins prox.gen.sg-f importance do.tell-imp.sg;Well, this is the month of Ramadan, explain its importance in simple words.;;;;;;;;;;;;;
20230519-WheatCuttingDiscussionBetweenNoorHussanMisbahSirajAndMuneerAhmad;130;no;bimillah;<Not Sure>;bimillah;in the name of Allah;Ar;keriu;ker-iu;do-imp.pl;ʥ-iu nori maːla bikili-ãː ʥ-iu maːla bikili-ãː bimillah ker-iu ʥ-iu;come-imp.pl now down field-dat come-imp.pl down field-dat in the name of Allah do-imp.pl come-imp.pl;should we starts(Bismillah) now in below field;;;;;;;;;;;;;
20230519-WheatCuttingDiscussionBetweenNoorHussanMisbahSirajAndMuneerAhmad;135;no;bismillah;<Not Sure>;bismillah;in the name of Allah;Ar;kiriu;kir-iu;do-imp.pl;bas bismillah kir-iu;okay in the name of Allah do-imp.pl;Start in the name of Allah;;;;;;;;;;;;;
20230519-WheatCuttingDiscussionBetweenNoorHussanMisbahSirajAndMuneerAhmad;137;no;bismillah;<Not Sure>;bismillah;in the name of Allah;Ar;kiriu;kir-iu;do-imp.pl;bismillah kir-iu bismillah;in the name of Allah do-imp.pl in the name of Allah;start(in the name of Allah);;;;;;;;;;;;;
20230519-WheatCuttingDiscussionBetweenNoorHussanMisbahSirajAndMuneerAhmad;222;no;bismillah;<Not Sure>;bismillah;in the name of Allah;Ar;kariu;kar-iu;do-imp.pl;bismillah kar-iu filhaːl du zan sa ɬ-iu;in the name of Allah do-imp.pl for.now two person prox.obl.sg give-imp.pl;for now two person should start harvesting;;;;;;;;;;;;;
20220126-AfserStory;44;yes;kraːs;nm;kraːs;cross;Eng;ke;ke;do.cv;tine gavar law bot aman-a bliaːja gila ʈal-an-a bas sẽu-a kraːs ke tine aɖaː naŋg-ok;there Gawar very be.pst.3pl our-m brother pl Til-gen-m okay obl cross do.cv there get.off-pst.1pl;There were more Guar people and the driver dropped us off.;10;;;;;;;;;;;;
20220126-AfserStory;47;yes;kraːs;nm;kraːs;cross;Eng;ke;ke;do.cv;ja fuʈugraːfar-an-i dukaːn bui aman-a sa mandakbarana sa bi ɕiki kraːs ke ga-ik ga-ik;indf photographer-gen-f shop be.pst.3f.sg our-m prox.obl.sg prox.obl.sg add so cross do.cv go-vn go-vn;None;10;;;;;;;;;;;;
20211003-RahimFarming;159;no;ɕauqe;nf;ɕauq-e;interest-erg/ins;Ar;kei;ke-i;do-cv;tasa maːnuʂ ɕauq-e ke-i;dist.obl.sg man interest-erg/ins do-cv;The person would grow them with enthusiasm;;;;;;;;;;;;;
20221030-HizbullahTellingAboutAGame;58;no;inʈarwiu;nf;inʈarwiu;interview;Eng;kewa;ke-wa;do-imp.pl;woj baːl-a woj ɕiki ɕiki ke-maːn ʥa-i inʈarwiu ke-wa nijaː;prox.sg look-imp.sg prox.sg so so do-prs.3sg say-cv interview do-imp.pl;Look well and say that so-and-so is doing this at the moment;;;;;;;;;;;;;
20230112-NoorHassanTellingLifeStory;228;yes;kors;n;kors;course;Eng;kedaːus;ke-daːus;do-dist.pst.3sg;law inŋliɕ -an-i kors ke-daːus se laka jafuʈi inʈeliʥenʈ bua;very English gen-f course do-dist.pst.3sg dist.sg like indf-little intelligent be.pst.3m.sg;he was intelligent, he knew English;17;;;;;;;;;;;;
20220406-AtiqWorkingAtGarden;4;yes;sawaːlaːt;nf;sawaːl-aːt;question;Ar;kemek;ke-mek;do-prs.1pl;mo manzi ite kʰaːra-a atiqullah tʰana ama asa pena kʰaːra-an-a mutaːliq sawaːl-aːt ke-mek;I.obl with/at here garden-obl Atiqullah be.prs.3m.sg we prox.obl.sg from garden-gen-m concerning question-pl do-prs.1pl;Atiqullah is with me in this garden and we ask him questions about the garden.;8;;;;;;;;;;;;
20220408-FahimWatchingTongachalaik;22;no;azaːd;adj;azaːd;free;Per;ke;ke;do.cv;giri hãː ʨala-met se giri inaːm jaː ʈoŋg-aː azaːd ke ba-maːn ja na ba-maːn jaː se ʨur b-imaːn giri;then yes run-prs.3pl dist.sg then Inam pit-dat free do.cv can-prs.3sg indf not can-prs.3sg or dist.sg four be-prs.3sg again;By winning more pebbles, you can free your closed pit again.;;;;;;;;;;;;;
20220408-HizbullahPlayingDubbleKhargai;75;yes;paidaː;adj;paidaː;appeared;Per;keroaː;ker-o-aː;do-pst.2pl;nori paidaː ker-o-aː me;now appeared do-pst.2pl you.pl;just born;1;;;;;;;;;;;;
20220408-InamPlayingGuldanda;22;no;keʨ;n;keʨ;catch;Eng;kemet;ke-met;do-prs.3pl;keʨ ke-met keʨ ker-on ba giri aːuʈ b-imaːn;catch do-prs.3pl catch do-pst.3pl irr then out be-prs.3sg;After making a catch, they are out;;;;;;;;;;;;;
20220408-InamPlayingGuldanda;22;no;keʨ;n;keʨ;catch;Eng;keron;ker-on;do-pst.3pl;keʨ ke-met keʨ ker-on ba giri aːuʈ b-imaːn;catch do-prs.3pl catch do-pst.3pl irr then out be-prs.3sg;After making a catch, they are out;;;;;;;;;;;;;
20220408-InamPlayingGuldanda;27;no;keʨ;n;keʨ;catch;Eng;ke;ke;do.cv;tasu giri jaː keʨ ke ba-met jaː na ba-met;dist.obl.pl then or catch do.cv can-prs.3pl or not can-prs.3pl;They can either be caught or not;;;;;;;;;;;;;
20220409-RafeezUllahDarsolQuran;53;yes;mukamal;adj;mukamal;complete;Ar;kemet;ke-met;do-prs.3pl;tasu waɽai hifiz ke-met ilmani kors mukamal ke-met parz-os-aː woj tasu xalq-an-i qurbaːni-n-i waʥa-e ɬɪ;dist.obl.pl people(?) Quran.memorizer do-prs.3pl course complete do-prs.3pl understand-pst.2sg-q prox.sg dist.obl.pl people-gen-f sacrifice-gen-f reason-erg/ins by;So because of the sacrifice of these people, they memorize and acquire knowledge.;22;;;;;;;;;;;;
20211003-AliIntrwPolitics;197;yes;kaʈ;<Not Sure>;kaʈ;cut;Ur;keto;ke-to;do-prf.2pl;asa me paːkistaːn-a pena me bilkul kaʈ ke-to;prox.obl.sg you.pl Pakistan-obl from you.pl exactly cut(?) do-prf.2pl;You have completely separated it from Pakistan;19;;;;;;;;;;;;
20230507-ConversationBetweenPrincipalAndATeacher;165;no;iɕu;n;iɕu;issue;Eng;keika;ke-ika;do-fut.1pl;xo bas peʈran tajaːr bua ba tasa ama iɕu ke-ika;but okay pattern ready be.pst.3m.sg irr dist.obl.sg we issue do-fut.1pl;when we have finished the pattren, we will show you;;;;;;;;;;;;;
20221009-InamullahCuttingfruit;31;yes;maida;n;maida;cutting;Per;kei;ke-i;do-cv;giri sa ʥu himan giri aa maida ke-i;then prox.obl.sg winter then cutting do-cv;The we eat it in winter.;5;;;;;;;;;;;;
20221009-InamullahCuttingfruit;51;yes;maida;n;maida;cutting;Per;ke;ke;do.cv;maida maida ke hãː hãː giri ʈaʂʈaː ki tala-i hid-ãː ki aŋgasa-met law zan;cutting cutting do.cv yes yes then to put-cv dat to climb.caus-prs.3pl very person;After cutting them, we keep them in the oven above;5;;;;;;;;;;;;
20230112-NoorHassanTellingLifeStory;69;yes;maida;n;maida;cutting;Per;ke;ke;do.cv;tasa kʰankaːr -a aːn-i tine kamra-a maida maida ke ʐu-i;dist.obl.sg watermelon obl bring-cv there room-obl cutting cutting do.cv eat-cv;we cut that watermelon and ate;5;;;;;;;;;;;;
20230113-SubhaUllahTalkingAboutHisBusiness;76;yes;maida;n;maida;cutting;Per;ke;ke;do.cv;taːnu sa laːm -an-a xalq-ãː ki maida maida ke ʨensa ke-i;self's prox.obl.sg village gen-m people-dat to cutting cutting do.cv do-cv;then we chop it into pieces for the village people;5;;;;;;;;;;;;
20230327-MuhammadAliShahTalkingAboutLemonGarden;156;no;kilo;n;kilo;kilogram;Eng;kei;ke-i;do-cv;muj gaː-i baːzaːr -a gaː-i law aːrzaːn eksaupaʨaːs rupai -e kilo ke-i muj tine gaː-i dafa ɬijai ʈʰaːn ʈʰaːn-a nim nim kilo -an-a ɬijai;I.erg carry-cv market obl carry-cv very cheap two.hundred.and.fifty rupee erg/ins kilogram do-cv I.erg there carry-cv turn area area-obl half half kilogram gen-m;i carry them to Darosh Bazar and kept at different places and sold it cheaply at two hundred and fifty;;;;;;;;;;;;;
20220101-HajiLiteratureIntrw;18;no;qismana;n;qism-an-a;kind-gen-m;Ar;ɬam keriu;ɬam ker-iu;do.work-pst.2sg;tine ʈem-a ki qism-an-a ɬam ker-iu ki qism-an-i xidmaːt bui men-i;there time-obl what kind-gen-m do.work-pst.2sg what kind-gen-f service be.pst.3f.sg your.pl-f;What kind of work you did that time, what kind of service it was.;;;;;;;;;;;;;
20221015-GholamRazaqTellingFolkTale;36;no;faːʈʂaː;n;faːʈʂaː;king;;kemek;ke-mek;do-prs.1pl;ga ãː ʥa-on ʨi asa maːnuʂ-a faːʈʂaː ke-mek woj laka nuŋg-a tine laːm-ãː ʥ-ibua;say-pst.3pl that prox.obl.sg man-obl king do-prs.1pl prox.sg like new-obl there village-dat come-dist.pst.3m.sg;Now the people of the village decided to make this stranger a king;;;;;;;;;;;;;
20221015-GholamRazaqTellingFolkTale;39;no;faːʈʂaː;n;faːʈʂaː;king;;keron;ker-on;do-pst.3pl;tasa xo faːʈʂaː ker-on tasan-i xo nori ʨal-imaːn niaː;dist.obl.sg king do-pst.3pl dist.gen.sg-f now run-prs.3sg;Now the new king has become, now his rule is followed;;;;;;;;;;;;;
20230519-ConversationBetweenJamrozKhanBabaAndRahimullah;199;yes;maida;n;maida;cutting;Per;ke;ke;do.cv;aːnda-a maida maida ke ta -a tasu waɽai ʐuwa-i;meat-obl cutting cutting do.cv obl dist.obl.pl feed-cv;the meat was cut into pieces and cooked and fed them;5;;;;;;;;;;;;
20220410-HishamWithGrass;59;yes;dama;n;dama;rest;Psh;kemesaː;ke-mes-aː;do-prs.2sg-q;bis mineʈ-ãː aːma feda-mes-aː giri ki ke-mes aːma giri dama ke-mes-aː giri ki ki ke-mes feda-i;twenty minute-dat house reach-prs.2sg-q then what do-prs.2sg house then rest do-prs.2sg-q then what what do-prs.2sg reach-cv;Do you get home in twenty minutes and rest?;4;;;;;;;;;;;;
20230228-DrSyedAkberTalkingAboutLife;72;yes;difaː;n;difa-a;defence;Ar;kerum;ker-um;do-pst.1sg;muj taːnu mulk paːkistaːn -a ʂaʦi bi tine dar-i law difa-a ker-um;I.erg self's country Pakistan obl for add there stay-cv very defence-obl do-pst.1sg;but during that time i represented my nation pakistan and defended it;20;;;;;;;;;;;;
20230228-DrSyedAkberTalkingAboutLife;86;yes;difaː;n;difa-a;defence;Ar;kemet;ke-met;do-prs.3pl;sahi paːkistaːni kara bot ba time taːnu mulk -an-a difa-a ke-met;true Pakistanis who be.pst.3pl rel dist.pl self's country gen-m defence-obl do-prs.3pl;the true patriot of pakistan defend their country;20;;;;;;;;;;;;
20220410-HishamWithGrass;60;yes;dama;n;dama;rest;Psh;kemem;ke-mem;do-prs.1sg;feda-i giri aːma di ja saːt dama ke-mem;reach-cv then house go.cv indf little rest do-prs.1sg;Yes, I take some rest;4;;;;;;;;;;;;
20230215-SharGhaniTreatmentWitPatient;144;yes;ɖipenɖ;n;ɖipenɖ;dependence;Eng;kemaːn;ke-maːn;do-prs.3sg;solaː hazaːr ate aspataːl -a rataj kasaːn abaːdi ɖipenɖ ke-maːn;sixteen thousand here hospital obl on people population dependence do-prs.3sg;Sixteen thousand depend on this hospital;19;;;;;;;;;;;;
20230215-SharGhaniTreatmentWitPatient;145;yes;ɖipenɖ;n;ɖipenɖ;dependence;Eng;kemaːn;ke-maːn;do-prs.3sg;solaː hazaːr abaːdi te rataj ɖipenɖ ke-maːn;sixteen thousand population dist.obl.sg on dependence do-prs.3sg;Sixteen thousand turn here;19;;;;;;;;;;;;
20230327-MuhammadAliShahTalkingAboutLemonGarden;21;yes;ɖipenɖ;n;ɖipenɖ;dependence;Eng;kedaːon;ke-daːon;do-dist.pst.3pl;bas ʂaːli asu ja du ɬe fasl -a rataj ɖipenɖ ke-daːon xalaq -e;okay rice prox.obl.pl indf two three crop obl on dependence do-dist.pst.3pl people erg/ins;or paddy (rice crop), our people were focused on these two or three crops;8;;;;;;;;;;;;
20220122-ShakhiWaterMill;43;yes;xatam;n;xatam;depletion;Ar;kemaːn;ke-maːn;do-prs.3sg;vaːri te aːn-imet te vaʈaːmin-a xatam na ke-maːn maːɕin xo suʨa vaʈaːmin-a xatam ke-maːn parz-os-aː;rest here bring-prs.3pl dist.obl.sg vitamin-obl depletion not do-prs.3sg machine but traditional vitamin-obl depletion do-prs.3sg understand-pst.2sg-q;The rest is brought in. It does not deplete vitamins. The machine does not deplete vitamins;9;;;;;;;;;;;;
20220122-ShakhiWaterMill;51;yes;xatam;n;xatam;depletion;Ar;kemaːn;ke-maːn;do-prs.3sg;karnel saːhib karik tʰana ba se vaːʈaːmin maːɕin xatam ke-maːn ʥa-i;colonel Sir which be.prs.3m.sg rel dist.sg vitamin machine depletion do-prs.3sg say-cv;Colonel understands that the machine eliminates vitamins;9;;;;;;;;;;;;
20220124-SadaatVisitAkroiToArandugole;46;yes;kaʈaːi;<Not Sure>;kaʈaːi;destroy;;kedaːon;ke-daːon;do-dist.pst.3pl;au bui zaŋgal ta taua ze ta kaʈaːi ke-daːon ta kaʈaːi;and be.pst.3f.sg forest comp destroy(?) do-dist.pst.3pl destroy(?);And that place was a forest, but people had destroyed it.;8;;;;;;;;;;;;
20220124-SadaatVisitAkroiToArandugole;48;yes;tabaːʰubarbaːd;adj;tabaːʰubarbaːd;destroyed;Per;keton;ke-ton;do-prf.3pl;tasu bi ke-i xair amaj taːnu manzi ʥa-ua ãː woj xo law tabaːhi qaum-an-a ɕai-a tabaːʰubarbaːd ke-ton woj xo saːf-an-a tʰana xo xair;dist.obl.pl add do-cv well we.erg self's with/at say-pst.3m.sg I prox.sg very tribe-gen-m thing-obl destroyed do-prf.3pl prox.sg all-gen-m be.prs.3m.sg but well;We saw that place and talked among ourselves that it is destroyed, and it is the asset of the whole nation.;20;;;;;;;;;;;;
20230629-DayFirstOfEidulAdha;150;yes;ɣar;adj;ɣar;destroyed;Psh?;kemaːn;ke-maːn;do-prs.3sg;ʐu-i ʐu-i ja du ɬe aːma-a ziaːt ker-on ba ta ɣar ke-maːn;eat-cv eat-cv indf two three house-obl more do-pst.3pl irr destroyed do-prs.3sg;if you eat more you will become ill;5;;;;;;;;;;;;
20220410-HishamWithGrass;61;yes;dama;n;dama;rest;Psh;kerike;ker-ik-e;do-vn-erg/ins;dama ker-ik-e baːd;rest do-vn-erg/ins after;After taking rest?;4;;;;;;;;;;;;
20211031-GhulamIntrwPolitics;115;yes;taraqi;n;taraqi;development;Ar;keiba;ke-iba;do-fut.3sg;kulaːu bua ba au inɕaːllah ul aziz aman-a ilaːqa jafala taraqi ke-iba;opened be.pst.3m.sg irr and God willing our-m area some development do-fut.3sg;If the border is opened then inshallah it will bring some progress;19;;;;;;;;;;;;
20230111-IjazUllahTeachingAtIPS;191;yes;taraqi;n;taraqi;development;Ar;keta;ke-ta;do-fut.3pl;kʰulaːu bi giri ɕil-a b-iba ze pudam d-i ki ɕai ke-ta taraqi ke-ta;opened add then such-m be-fut.3sg comp forward go-cv what thing do-fut.3pl development do-fut.3pl;they can move on to development;19;;;;;;;;;;;;
20230228-DrSyedAkberTalkingAboutLife;115;yes;ɖiwilap;n;ɖiwilap;development;Eng;keik;ke-ik;do-vn;asa ama ɖiwilap ke-ik -a ʂaʦi;prox.obl.sg we development do-vn obl for;to develop it more;19;;;;;;;;;;;;
20230624-AgricultureActivity;63;yes;taraqi;n;taraqi;development;Ar;kei;ke-i;do-cv;nori mazid taraqi ke-i bumpali b-imaːn te ki;now more development do-cv peanut be-prs.3sg dist.obl.sg;now it developed and peanuts are cultivated;8;;;;;;;;;;;;
20230215-AliNawazTreatmentWithPatient;43;yes;ɖupluma;n;ɖupluma;diploma;Eng;kerum;ker-um;do-pst.1sg;tena gaim ɖupluma ker-um ʨatraːl -a;from.there go.pst.1sg diploma do-pst.1sg Chitral obl;get the diploma in Chitral;17;;;;;;;;;;;;
20221030-MuhibUllahAboutFarming;43;no;ɖanɖ;n;ɖanɖ;lake;;ke;ke;do.cv;iʂʈau ʥa-met parz-os-aː ɖanɖ ke hiraːi-i ke tasa gila ke uʂʈa-mek;planting say-prs.3pl understand-pst.2sg-q lake do.cv mud do.cv dist.obl.sg thing do.cv sow-prs.1pl;There is a different method of paddy cultivation for which the field is irrigated with water;;;;;;;;;;;;;
20230519-WheatCuttingDiscussionBetweenNoorHussanMisbahSirajAndMuneerAhmad;15;no;gaːʂʈi;n;gaːʂʈi;language;;keraːwa;ker-aːwa;do-inf;tu sai baːti ke-mes ton-i gaːʂʈi ker-aːwa law graːn tʰ-imaːn ie baːja xo bas;you.sg word do-prs.2sg your-f language do-inf very difficult be-prs.3sg yes brother or okay;you are saying right, it is difficult to do like you;;;;;;;;;;;;;
20220409-RafeezUllahDarsolQuran;26;no;gaːʂʈi;n;gaːʂʈi;language;;kemes;ke-mes;do-prs.2sg;tu darsulquraːn gawar gaːʂʈi ke-mes ʨun-ki jak maːɕra-an-i aman-i zabaːn karik zabaːn tʰini gawarbaːti tʰini allah taaːla-an-i ɬ-isan zabaːn;you.sg Dars.al-Qur'an Gawar language do-prs.2sg because(?) one society-gen-f our-f language which language be.prs.3f.sg Gawar-word be.prs.3f.sg God almighty-gen-f give-ptcp.pf language;One of the languages given by Allah is Guarbati, you also teach in Guarbati here.;;;;;;;;;;;;;
20220409-RafeezUllahDarsolQuran;30;no;zubaːne;n;zubaːn-e;language-erg/ins;Per;keika;ke-ika;do-fut.1pl;ɕila-ãː ki baːjad zi amãː pakaːr tʰana ʨi ama law koɕiɕ woj ke-mek ʨi ama gawargaːʂʈi taːnu zubaːn-e ke-ika;such.thing-dat to comp we.dat necessity be.prs.3m.sg that we very attempt prox.sg do-prs.1pl that we Gawar-language self's language-erg/ins do-fut.1pl;That is why we try to teach in Guarbati language;;;;;;;;;;;;;
20211031-GhulamIntrwPolitics;29;no;leɖar;n;leɖar;leader;Eng;keok;ke-ok;do-pst.1pl;taːlimjaːfta maːnuʂ-a leɖar ke-ok ba inɕaː aːllah aman-a laːm pudam d-iba;educated man-obl leader do-pst.1pl irr inshallah our-m village forward go-fut.3sg;If educated leaders are elected then inshallah we will move forward;;;;;;;;;;;;;
20220417-RahimUllahZamidari;24;no;kam;adj;kam;little;;kemet;ke-met;do-prs.3pl;nori asa kam kam ke-met asa kʰuɕ-imet kʰuɕ-i jaː karaːu-e ɬɪ parata-met jaː kondaːl-e ɬi asa kʰuɕ-i iʂʈa ke parz-os-aː asa aːu ke ʂa-i luɽa-met;now prox.obl.sg little little do-prs.3pl prox.obl.sg dig-prs.3pl dig-cv erg/ins by prs.3pl or erg/ins by prox.obl.sg dig-cv do.cv understand-pst.2sg-q prox.obl.sg water do.cv send-cv prs.3pl;Now the tendency of people towards farming is less so now they dig with spades;;;;;;;;;;;;;
20220718-RahmatUllahServices;45;no;leʈar;n;leʈar;letter;Eng;kera;ker-a;do-imp.sg;giri ʥa-us ʨi jaːr leʈar ker-a;then say-pst.3sg that friend letter do-imp.sg;Then he said do the letter;;;;;;;;;;;;;
20230507-ConversationBetweenPrincipalAndATeacher;150;no;leʈar;n;leʈar;letter;Eng;kedaːu;ke-daːu;do-dist.pst.2sg;asaː zi se leʈar ke-daːu fri -an-a baːraː;prox.dat.pl comp dist.sg letter do-dist.pst.2sg Farya(?) gen-m about;and that latter written about Farya;;;;;;;;;;;;;
