text_title;sentence_number;include;preceding_word;preceding_word_pos;preceding_word_morph;preceding_word_gls;borrowing;verb;verb_morph;verb_gls;sentence;sentence_gls;sentence_trsl;semantic_field;;;;;;;;;;;;
20220718-QaderAndBabarConversation;133;yes;xatum;adj;xatum;absent;Ar;keji;ke-ji;do-cv;lihaːzaː woj mon-i peɣaːm tʰini ʨi badneti-a xatum ke-ji ja bliaːja ʐup-i ja qaum ʐup-i;so prox.sg my-f message be.prs.3f.sg that malice-obl absent do-cv indf brother become-cv indf tribe become-cv;So I give this message to end the malice of each other and become one nation;20;;;;;;;;;;;;
20220718-RahmatUllahServices;66;yes;xatum;adj;xatum;absent;Ar;keus;ke-us;do-pst.3sg;imraːn xaːn saːib-an-i hukumat ʥ-i asa paisa-a en xatum ke-us;Imran Khan Sir-gen-f government come-cv prox.obl.sg money-obl prox.erg/ins absent do-pst.3sg;Imran Khan ended this program;1;;;;;;;;;;;;
20220718-RahmatUllahServices;145;yes;xatum;adj;xatum;absent;Ar;kerusãː;ker-us-ãː;do-pst.3sg-dat;asan-a baːd ʨi mon-a baːp-e siaːsat-a xatum ker-us-ãː;prox.gen.sg-m after that my-m father-erg/ins politics-obl absent do-pst.3sg-dat;When my father gave up politics;19;;;;;;;;;;;;
20230514-ConversationBetweenHabibZamanAndAnUllah;36;no;xatum;adj;xatum;absent;Ar;keika;ke-ika;do-fut.1pl;leɬ meɬ -a xatum ke-ika giri baːl-ika ki rau b-imaːntiba;harvest m-redupl obl absent do-fut.1pl then look-fut.1pl what way be-debit.3sg;will see after the harvesting of wheat;;;;;;;;;;;;;
20220718-RahmatUllahServices;170;yes;ekʈiweʈ;<Not Sure>;ekʈiweʈ;activate;Eng;kerum;ker-um;do-pst.1sg;te muj taqriban law kasaːn-a ekʈiweʈ ker-um;dist.obl.sg I.erg approximately very people-obl activate do-pst.1sg;In this, I have enabled many new people;19;;;;;;;;;;;;
20220718-RahmatUllahServices;174;yes;ekʈiweʈ;<Not Sure>;ekʈiweʈ;activate;Eng;kerumãː;ker-um-ãː;do-pst.1sg-dat;tasa manzi gila ke tasãː kaːl ke tasan-a ekʈiweʈ ker-um-ãː;dist.obl.sg with/at thing do.cv dist.dat.sg year do.cv dist.gen.sg-m activate do-pst.1sg-dat;I mobalized them by calling them;19;;;;;;;;;;;;
20221009-AbulHassanCuttingMaize;36;yes;lubus;n;lubus;adding;;ke;ke;do.cv;biu tala-i paʂ lubus ke;seeds put-cv dung adding do.cv;By adding seeds and fertilizers;8;;;;;;;;;;;;
20220123-MAShahAdbiSargarmi;138;yes;qabul;n;qabul;acceptance;Ar;kei;ke-i;do-cv;tasãː muj riquesʈ ke-um-ãː teni asa ta-i xoɕaːl bi qabul ke-i;dist.dat.sg I.erg request do-pst.1sg-dat dist.erg.sg prox.obl.sg see-cv happy add acceptance do-cv;i requisted and they accepted it;19;;;;;;;;;;;;
20230111-AmirWaliShahAtMedicalStor;104;yes;daːxila;n;daːxil-a;admission;Ar;kerok;ker-ok;do-pst.1pl;daːxil-a ker-ok ʈu ijer-an-a ɖupluma bua tine;admission-obl do-pst.1pl two year-gen-m diploma be.pst.3m.sg there;got admission for two year diploma;19;;;;;;;;;;;;
20211003-AliIntrwPolitics;121;yes;paːlisia;n;paːlisi-a;policy;Eng;bajaːn kedaːum;bajaːn ke-daːum;do.tell-dist.pst.1sg;paːlisi-a bajaːn ke-daːum;policy-obl do.tell-dist.pst.1sg;I explained the policy;18;;;;;;;;;;;;
20211003-AliIntrwPolitics;170;yes;swaːl;nf;swaːl;question;Ar;ke;ke;do.cv;naj kark-aː̄ ama swaːl ke ba-mek;no someone-dat we question do.cv can-prs.1pl;Then we will not need anyone;19;;;;;;;;;;;;
20220101-HajiLiteratureIntrw;135.1;no;nasihat;n;nasihat;advice;Ar;kera;ker-a;do-imp.sg;mon-a aulaːd-ãː nasihat ker-a naː;my-m offspring-dat advice do-imp.sg;Admonish my children,;;;;;;;;;;;;;
20220101-HajiLiteratureIntrw;135.2;no;nasihat;n;nasihat;advice;Ar;kera;ker-a;do-imp.sg;mon-a aulaːd-ãː nasihat ker-a naː;my-m offspring-dat advice do-imp.sg;admonish my children;;;;;;;;;;;;;
20230228-DrSyedAkberTalkingAboutLife;116;yes;koɕiɕ;nf;koɕiɕ;attempt;Per;keika;ke-ika;do-fut.1pl;har forum -a ama koɕiɕ ke-ika;every forum obl we attempt do-fut.1pl;will strive on every fourm;18;;;;;;;;;;;;
20211003-AliIntrwPolitics;68;yes;ɕuro;n;ɕuro;start;Ar;ketok;ke-tok;do-prf.1pl;ɕuro ke-tok;start do-prf.1pl;we have started;9;;;;;;;;;;;;
20230409-GulMuhammadTalkingAboutMeyaMosque;37;yes;koɕiɕ;nf;koɕiɕ;attempt;Per;kemek;ke-mek;do-prs.1pl;ama koɕiɕ ke-mek amn-a taːnu bliaːja gila-āː ki;we attempt do-prs.1pl our-m self's brother pl-dat to;we are trying for our brothers;22;;;;;;;;;;;;
20230409-GulMuhammadTalkingAboutMeyaMosque;116;yes;koɕiɕ;nf;koɕiɕ;attempt;Per;kemaːn;ke-maːn;do-prs.3sg;au waːri bi koɕiɕ ke-maːn xudaːi asa jafala bi asa rat ke-ijau;and besides add attempt do-prs.3sg God prox.obl.sg some add prox.obl.sg open(?) do-opt;Their efforts are still ongoing, may Allah make them successful;22;;;;;;;;;;;;
20220408-InamPlayingGuldanda;55;no;saːf;n;saːf;all;;kejetiu;ke-jetiu;do;jak zan jak ke-maːn jaː du ke-man se saːf ɖiaːi-naːm giri gila ke-met ɬ-imet gila ɬ-imet saːf ke-jetiu ʥa-i;one person one do-prs.3sg or two do-prs.3sg dist.sg all friend-pl then thing do-prs.3pl give-prs.3pl thing give-prs.3pl all do say-cv;A player can hit his turn twice and share with his teammates;;;;;;;;;;;;;
20220710-FarozKhanEidWishing;23;no;saːfe;n;saːf-e;all-erg/ins;;kedaːon;ke-daːon;do-dist.pst.3pl;qurbaːni ke-on saːf-e ke-daːon kark-en ke-daːon kark-en na ke-daːon;sacrifice do-pst.3pl all-erg/ins do-dist.pst.3pl someone do-dist.pst.3pl someone not do-dist.pst.3pl;Some people had sacrificed and some had not;;;;;;;;;;;;;
20221009-InamullahCuttingfruit;62;no;ikula;adj;ikula;alone;;kemem;ke-mem;do-prs.1sg;sa mo manzi madad kara zaːtak muʂai bi law ke-met kara bot ba ke-met na bot ba ʥu ikula ke-mem;prox.obl.sg I.obl with/at help who young.people add very do-prs.3pl some be.pst.3pl irr do-prs.3pl not be.pst.3pl irr alone do-prs.1sg;None;;;;;;;;;;;;;
20211003-RahimFarming;29;yes;liwaːl;adj;liwaːl;sharp;;kei;ke-i;do-cv;muj ʂaːli-a ʂaʨi ja du hāka muj gaː-i lawans-a ʂoban-a tareqa e liwaːl ke-i aːn-i aːma-a tʰo-idaːum;I.erg rice-obl for one two sickle I.erg carry-cv Drosh-obl beautiful-m way erg/ins sharp do-cv bring-cv house-obl put-dist.pst.1sg;I had properly prepared a couple of sickles from Drosh for harvesting paddy and kept them at home;8;;;;;;;;;;;;
20211003-SadatIntrwHealth;33;yes;baːbuaːn;n;baːbuaːn;Babu.dispensary;;ɬam kejt;ɬam ke-jt;do.work-pst.3pl;tine ʈem-a baːbuaːn ɬam ke-jt dara-an-a tʰit;that.obl time-obl Babu.dispensary do.work-pst.3pl up-gen-m be-pst.3pl;At that time Babu used to work which was from the upper place from Darosh or Chitral;9;;;;;;;;;;;;
20220123-MAShahAdbiSargarmi;107;yes;ʈaːip;n;ʈaːip;typing;Eng;kemaːn;ke-maːn;do-prs.3sg;mon-a voi puɬ fazl akbar asa mãː ʈaːip ke-maːn;my-m prox.sg son Fazal Akbar prox.obl.sg I.dat typing do-prs.3sg;my son Fazal Akbar types it;9;;;;;;;;;;;;
20220123-MAShahAdbiSargarmi;113;yes;ʈaːip;n;ʈaːip;typing;Eng;keravamem;ker-ava-mem;do-prs.1sg;jaː ãː dara d-imem kaɖa-i sara voi tine tʰ-imaːn tine d-i ʈaːip ker-ava-mem jaː voi maːla ʥ-imaːn ki taur-e voi mãː ʈaːip ke-maːn;or I up go-prs.1sg erg/ins with prox.sg there be-prs.3sg there go-cv typing do-prs.1sg or prox.sg down come-prs.3sg erg/ins prox.sg I.dat typing do-prs.3sg;either i go up and type or he comes and do the typing here;9;;;;;;;;;;;;
20230507-ConversationBetweenQilaatKhanAndWarisha;115;no;taraːna;n;taraːna;anthem;Per;kei;ke-i;do-cv;ate ʥi taraːna ke-i;here come.cv anthem do-cv;come here after speaking the anthem;;;;;;;;;;;;;
20230507-ConversationBetweenQilaatKhanAndWarisha;117;no;taraːna;n;taraːna;anthem;Per;ke;ke;do.cv;waxta tu taraːna ke ke-mes-aː;at.first you.sg anthem do.cv do-prs.2sg-q;what do you do before the anthem;;;;;;;;;;;;;
20230507-ConversationBetweenQilaatKhanAndWarisha;133;no;taraːna;n;taraːna;anthem;Per;kemaːniuaː;ke-maːniu-aː;do-prs.2pl-q;taraːna ke-maːniu-aː;anthem do-prs.2pl-q;did you read the anthem?;;;;;;;;;;;;;
20220123-MAShahAdbiSargarmi;113;yes;ʈaːip;n;ʈaːip;typing;Eng;kemaːn;ke-maːn;do-prs.3sg;jaː ãː dara d-imem kaɖa-i sara voi tine tʰ-imaːn tine d-i ʈaːip ker-ava-mem jaː voi maːla ʥ-imaːn ki taur-e voi mãː ʈaːip ke-maːn;or I up go-prs.1sg erg/ins with prox.sg there be-prs.3sg there go-cv typing do-prs.1sg or prox.sg down come-prs.3sg erg/ins prox.sg I.dat typing do-prs.3sg;either i go up and type or he comes and do the typing here;9;;;;;;;;;;;;
20220101-HajiLiteratureIntrw;137.1;yes;didaːr;n;didaːr;view;;kera;ker-a;do-imp.sg;mon-i ziaːrat-an-i didaːr ker-a;my-f grave-gen-f view do-imp.sg;Visit my grave,;10;;;;;;;;;;;;
20211031-GhulamIntrwPolitics;67;yes;laːma;nm;laːm-a;work;;ketus;ke-tus;do-prf.3sg;sahu tʰana se wari ʈʰaːn-a ɬam ke-tus na ke-tus xo aman-a laːm-a ke-tus;be.prs.3m.sg dist.sg rest area-obl do.work-prf.3sg not do-prf.3sg but our-m village-obl do-prf.3sg;We don't know about the rest but they have worked in our village;9;;;;;;;;;;;;
20220101-HajiLiteratureIntrw;143.1;yes;intizaːr;n;intizaːr;waiting;Ar;kera;ker-a;do-imp.sg;mon-i qiaːmat-a intizaːr ker-a;my-f resurrection-obl waiting do-imp.sg;Wait for my resurrection,;22;;;;;;;;;;;;
20230112-NoorHassanTellingLifeStory;167;yes;intizaːr;n;intizaːr;waiting;Ar;kera;ker-a;do-imp.sg;tiniãː d-i iarpoʈ-an-a ʈelifun ker-um-ãː ten ʥa-us jafuʈi intizaːr ker-a ʥ-imek;that.dat go-cv airport-gen-m telephone do-pst.1sg-dat dist.erg.sg say-pst.3sg indf-little waiting do-imp.sg come-prs.1pl;I called him from the airport, he said wait a little we are coming;10;;;;;;;;;;;;
20230112-NoorHassanTellingLifeStory;251;yes;intizr;n;intizr;waiting;Ar;keiu;ke-iu;do-opt;jafuʈi intizr ke-iu;indf-little waiting do-opt;wait a little;10;;;;;;;;;;;;
20151225-DinMuhammadFolkTale;84;;paidaː;adj;paidaː;appeared;Per;kei;ke-i;do-cv;ton-a ta sat blijaːja bot bana bi gait ama tãː ki ki-jan-a ɬuŋgɽa aːn-imek ama ta taːnu sasi gila-ãː ki ɬuŋgɽa paidaː ke-i ba-mek ʥa-won;your-m seven brother be.pst.3pl add go.pst.3pl we you.sg.dat to what-gen-m firewood bring-prs.1pl we self's sister pl-dat to firewood appeared do-cv can-prs.1pl say-pst.3pl;So the boys said that you had seven brothers, they got lost in the forest and here we cannot bring our sisters.;;;;;;;;;;;;;
20211003-RahimFarming;113;no;paidaː;adj;paidaː;appeared;Per;kes;ke-s;do-pst.2sg;hal paidaː ke-s ba ʐuɣaːʈa na tʰi;plough appeared do-pst.2sg irr not be.cv;among the parts of the plough, when you finds one part;;;;;;;;;;;;;
20211003-RahimFarming;114;no;paida;adj;paida;appeared;Per;kes;ke-s;do-pst.2sg;ʐuɣaːʈa paida ke-s ba hudin na tʰi;appeared do-pst.2sg irr plough.part not be.cv;the other one could be not available.;;;;;;;;;;;;;
20211003-RahimFarming;143;no;paidaː;adj;paidaː;appeared;Per;kes;ke-s;do-pst.2sg;ɣobal ke-mek ʥa-i gaː paidaː ke-s;oxen do-prs.1pl say-cv bull appeared do-pst.2sg;[Ghobal] oxen used to thresh the wheat through cattle;;;;;;;;;;;;;
20211003-RahimFarming;144;no;paidaː;adj;paidaː;appeared;Per;ke;ke;do.cv;le ʦur gadaː paidaː ke;three four donkey appeared do.cv;Also with two or three donkeys;;;;;;;;;;;;;
20230519-GroupConversationBetweenSharifUllahBahramKhanSharhussanAndImtiazAhmad;197;yes;intizaːr;n;intizaːr;waiting;Ar;keok;ke-ok;do-pst.1pl;rahim ʥ-a rai am tāː ki sax ɖal intizaːr ke-ok jaːr;Rahim come-imp.sg we you.sg.dat to difficult big waiting do-pst.1pl friend;hey Rahim come dear, we waited too much for you;10;;;;;;;;;;;;
20220701-AbulHassanNahairSafai;43;yes;nazar;n;nazar;watching;?;ketijau;ke-tijau;do;kara bi tʰanet ba sijaːsatdaːn asãː ki jafala nazar ke-tijau;who add be.prs.3pl irr politicians prox.dat.sg to some watching do;Whatever it is, politicians should keep an eye on these.;19;;;;;;;;;;;;
20220417-RahimUllahZamidari;19;yes;aːu;nm;aːu;water;;kei;ke-i;do-cv;giri musalasal asa hamiɕa aːu ke-i giri woj ʂaːli bi kuɽa b-imaːn;then prox.obl.sg water do-cv then prox.sg rice add plant be-prs.3sg;Then, by always giving timely water, it becomes a rice paneer;8;;;;;;;;;;;;
20220417-RahimUllahZamidari;18;yes;aːu;nm;aːu;water;;kemet;ke-met;do-prs.3pl;tala-i giri tasa ʈem ʈem-i aːu ke-met aːu ke-i giri tasan-a pat giri asa pek aːu-a ʂuk-an-i ke-i;put-cv then dist.obl.sg time time water do-prs.3pl water do-cv then dist.gen.sg-m after then prox.obl.sg a.little water-obl dry-gen-f do-cv;Then that paddy is put in this field and watered in time for rice cultivation;8;;;;;;;;;;;;
20221030-MuhibUllahAboutFarming;15;no;paidaː;adj;paidaː;appeared;Per;kerus;ker-us;do-pst.3sg;nun sobaːra allahpaːk-e law aːsaːniãː paidaː ker-us parz-os-aː;today nowadays God-clean-erg/ins very appeared do-pst.3sg understand-pst.2sg-q;None;;;;;;;;;;;;;
20221030-MuhibUllahAboutFarming;20;no;paidaː;adj;paidaː;appeared;Per;keus;ke-us;do-pst.3sg;au allah paːk-e nun amãː ki law aːsaːni paidaː ke-us;and God clean-erg/ins today we.dat to very ease appeared do-pst.3sg;This has been made easy by the grace of Allah;;;;;;;;;;;;;
20220417-RahimUllahZamidari;18;yes;aːu;nm;aːu;water;;kei;ke-i;do-cv;tala-i giri tasa ʈem ʈem-i aːu ke-met aːu ke-i giri tasan-a pat giri asa pek aːu-a ʂuk-an-i ke-i;put-cv then dist.obl.sg time time water do-prs.3pl water do-cv then dist.gen.sg-m after then prox.obl.sg a.little water-obl dry-gen-f do-cv;Then that paddy is put in this field and watered in time for rice cultivation;8;;;;;;;;;;;;
20220424-RahmatGhaniBabaKiSabziyat;47;yes;aːu;nm;aːu;water;;kera;ker-a;do-imp.sg;aːu-an-a tareqa-e ʈemʈem-a luʂua ba aːu ker-a;water-gen-obl way-erg/ins time-time-obl water do-imp.sg;Timely watering is required;8;;;;;;;;;;;;
20220417-RahimUllahZamidari;21;yes;hiraːji;n;hiraːji;watering;;kei;ke-i;do-cv;biu b-imaːn biu bi ki ʈem-a ʨi asan-i uʂʈak-an-i ʈem bui ba asa giri kʰaː-i parz-os-aː hiraːji ke-i iʂʈaːu ke-met;paneeri be-prs.3sg paneeri add what time-obl that prox.gen.sg-f gen-f time be.pst.3f.sg irr prox.obl.sg then take.out-cv understand-pst.2sg-q watering do-cv do-prs.3pl;When it is ready for cultivation or growing, it is removed from here and grown in other fields.;8;;;;;;;;;;;;
20230624-AgricultureActivity;50;yes;hiraːji;n;hiraːji;watering;;ket;ke-t;do-pst.3pl;gaː-naːm ʥo du hiraːji ke-t;bull-pl two watering do-pst.3pl;the bulls plough twice;8;;;;;;;;;;;;
20230327-MuhammadAliShahTalkingAboutLemonGarden;198;no;paidaː;adj;paidaː;appeared;Per;ketus;ke-tus;do-prf.3sg;allah-e bum -a har bemaːri -an-i ilaːʥ te bum -an-a manzi paidaː ke-tus;God-erg/ins earth obl every decease gen-f treatment dist.obl.sg earth gen-m with/at appeared do-prf.3sg;Allah has kept the cure of every disease in the product of this soil;;;;;;;;;;;;;
20230402-syedRahimTalkingAboutTaxi;93;no;paidaː;adj;paidaː;appeared;Per;kerana;ker-ana;do-nonfin.debit;ate mublel badal ker-ok ba aːma-a nika nika-ãː bi ki rizq paidaː ker-ana tʰina;here mobil.oil change do-pst.1pl irr house-obl children-dat add what livelihood appeared do-nonfin.debit be.prs.3m.sg;if we spend on vehicle then what will we feed our children at home;;;;;;;;;;;;;
20220506-ZiaUddinAfghanAtArandu;45;yes;istiqbaːl;<Not Sure>;istiqbaːl;welcome;Ar;keron;ker-on;do-pst.3pl;te aːj-awãː ki miãː ki raw-an-a istiqbaːl ker-on;dist.obl.sg come to I.dat what way-gen-m welcome do-pst.3pl;When you came to Arundu, how were you welcomed here?;19;;;;;;;;;;;;
20211003-SadatIntrwHealth;88;yes;baːbuaːn;n;baːbuaːn;Babu.dispensary;;ɬam kemet;ɬam ke-met;do.work-prs.3pl;au lihaːzaː amn-a baːbuaːn ɬam ke-met mauʥud-a;and so our-m Babu.dispensary do.work-prs.3pl present.moment-obl;currently the Babu [dispensor] works only;9;;;;;;;;;;;;
20230112-NoorHassanTellingLifeStory;261;yes;suluʈ;<Not Sure>;suluʈ;welcome;?;ke;ke;do.cv;gila ke suluʈ ke amãː ki gila ke-t parz-os-aː ʨi ime karik laka fariqaːna gila aːjat ʥa-i;thing do.cv welcome do.cv we.dat to thing do-pst.3pl understand-pst.2sg-q that prox.pl which like thing come.pst.3pl say-cv;they looked at us respectfully and welcome us;19;;;;;;;;;;;;
20230111-PrincipleAbdulHadiAtIPS;156;no;muqarar;adj;muqarar;appointed;Ar;ketok;ke-tok;do-prf.1pl;ki naj ki tasuãː ki wazifa muqarar ke-tok;dist.dat.pl to stipend(?) appointed do-prf.1pl;we have fixed some cartain stipend for them;;;;;;;;;;;;;
20211003-AliIntrwPolitics;184;yes;ba:ti;n;ba:ti;word;;ke;ke;do-cv;su ʂatsi karka manzi ba:ti kei toa: muta:liqa xalqa manzi;prox.pl.obl for someone.obl with/at discuss.cv ** ** people.obl with/at;All these issues to be presented before a concerned forum;18;;;;;;;;;;;;
20151225-DinMuhammadFolkTale;154;;ʈʰaːn;nm;ʈʰaːn;area;;kera;ker-a;do-imp.sg;lauzaŋgal-ãː nes-ui giri xoptam bui ʥo allah paːk-ãː suwaːl ke-us ze jaː allah ʥa-us ate muʈʰa manzi mãː ki ʈʰaːn ker-a quraːn bi mo pi tʰana ʥa-us-e au taːnu kejma;dense(?)-forest-dat come.out-pst.3f.sg then dark(?) be.pst.3f.sg God clean-dat question do-pst.3sg comp oh God say-pst.3sg here tree with/at I.dat to area do-imp.sg Quran add I.obl be.prs.3m.sg say-pst.3sg and self's do-fut.1sg;When it got dark in the forest, she begged Allah to give me a place in the middle of this big tree and I will recite the Qur'an[the Holy Book of Muslims] with me.;;;;;;;;;;;;;
20151225-DinMuhammadFolkTale;155.1;;ʈʰaːn;nm;ʈʰaːn;area;;kera;ker-a;do-imp.sg;ate muʈʰa manzi mãː ʈʰaːn ker-a quraːn-a go-i suwaːl ke-us suwaːl ke-us-ãː se muʈʰa dal-uwa manz naŋga-i;here tree with/at I.dat area do-imp.sg Quran-obl take-cv question do-pst.3sg question do-pst.3sg-dat dist.sg tree split-pst.3m.sg inside throw-cv;None;;;;;;;;;;;;;
20221030-MuhibUllahAboutFarming;10;no;ʈʰaːn;nm;ʈʰaːn;area;;ke;ke;do.cv;goit ɕil-i tʰini ʨi goit awal zamaːna-a bi du gaː-naːm-a ja ʈʰaːn ke;plough such-f be.prs.3f.sg that plough first time-obl add two bull-pl-obl indf area do.cv;Earlier we used to plow the fields with oxen;;;;;;;;;;;;;
20230519-WheatCuttingDiscussionBetweenNoorHussanMisbahSirajAndMuneerAhmad;190;no;ʈʰaːn;nm;ʈʰaːn;area;;keriu;ker-iu;do-imp.pl;mãː ʈʰaːn ker-iu rai leɬ-ãː;I.dat area do-imp.pl bro harvest-dat;make room for me;;;;;;;;;;;;;
20211031-GhulamIntrwPolitics;67;no;ʈʰaːna;nm;ʈʰaːn-a;area-obl;;ɬam ketus;ɬam ke-tus;do.work-prf.3sg;sahu tʰana se wari ʈʰaːn-a ɬam ke-tus na ke-tus xo aman-a laːm-a ke-tus;be.prs.3m.sg dist.sg rest area-obl do.work-prf.3sg not do-prf.3sg but our-m village-obl do-prf.3sg;We don't know about the rest but they have worked in our village;;;;;;;;;;;;;
20230327-MuhammadAliShahTalkingAboutLemonGarden;77;no;ilaːqaː;nm;ilaːqa-a;area-obl;Ar;kejetiau;ke-jeti-au;do-opt;tasu taːnu ilaːqa-a ke-jeti-au;dist.obl.pl self's area-obl do-opt;should be applied in their area;;;;;;;;;;;;;
20220716-AbdulQahirFoladNari;19.2;no;askari;n;askari;army;Ar;keok;ke-ok;do-pst.1pl;ja kata muda askari ke-ok;indf a.few time army do-pst.1pl;Spent sometime in Army;;;;;;;;;;;;;
20230409-GulMuhammadTalkingAboutMeyaMosque;117;no;bandubast;n;bandubast;arrangement;Per;keiu;ke-iu;do-opt;ʨi taufiq ɬ-ijau ʨi asa manzi bi munaːsib bandubast ke-iu;that blessing give-opt that prox.obl.sg with/at add proper arrangement do-opt;if gain the ability to perform, there will be suitable arrangements for them;;;;;;;;;;;;;
20230228-DrSyedAkberTalkingAboutLife;79;no;qaid;n;qaid;arrest(?);Ar;keron;ker-on;do-pst.3pl;qaid ker-on baːgraːm -a bom puli ʨarxi -a bom;arrest(?) do-pst.3pl Bargam obl be.pst.1sg Poli Charkhi obl be.pst.1sg;in prison i was at Bagram and Poli Charkhi;;;;;;;;;;;;;
20230514-ConversationBetweenHabibZamanAndAnUllah;49;yes;baːti;n;baːti;word;;kemek;ke-mek;do-prs.1pl;ʦus na b-itanem rai baːti maːti ke-mek naː;quite not be-prf.1m.sg word m-redupl do-prs.1pl;I am not quite, I ma talking;18;;;;;;;;;;;;
20211003-AliIntrwPolitics;61;yes;baːtia;nf;baːti-a;word;;kemem;ke-mem;do-prs.1sg;au nori ãː miaː̄ asa baːti-a ke-mem;and now I prox.obl.sg word-obl do-prs.1sg;And now I tell you this;18;;;;;;;;;;;;
20220706-AbdulMananTellingFolkTale[2];55;no;saːga;nm;saːga;ash;;keron;ker-on;do-pst.3pl;zaŋgal-ãː fed-i bagan-an-a muʈʰa-a haŋgaːr ʂa-i saːga ker-on;forest-dat arrive-cv plane.tree-gen-m tree-obl fire send-cv ash do-pst.3pl;After reaching the forest, he set fire to the poplar tree and burnt it to ashes;;;;;;;;;;;;;
20211003-SadatIntrwHealth;21;yes;baːti;nf;baːti;word;;kema;ke-ma;do-fut.1sg;tasan-a ʥawaːb-a ki hawaːl-aː ki ja baːti ke-ma;dist.gen.sg-m question(?)-obl answer(?)-dat to indf word do-fut.1sg;the answer of the question is such that;18;;;;;;;;;;;;
20211003-SadatLifeStory;95;yes;baːtia;nf;baːti-a;word;;kemem;ke-mem;do-prs.1sg;aː sa baːti-a ke-mem ze;I prox.obl.sg word-obl do-prs.1sg comp;I want to talk;18;;;;;;;;;;;;
20220122-FridIntrw;95;yes;baːti;nf;baːti;word;;kemes;ke-mes;do-prs.2sg;xaː vaːri ki baːti ke-mes ba taːnu bak-an-a;so rest what word do-prs.2sg self's side-gen-m;None;18;;;;;;;;;;;;
20220123-MulaAdinaLokDastan;306;yes;baːtinaːm;nf;baːti-naːm;word;;kemet;ke-met;do-prs.3pl;law igila-naːm baːti-naːm ke-met tasun-a hast-an-a ki ɕai b-iba;very pl word-pl do-prs.3pl dist.gen.pl-m hand-gen-m what thing be-fut.3sg;Nowadays they talk big things, maybe what will happen in their hands;18;;;;;;;;;;;;
20220124-SadaatVisitAkroiToArandugole;49;yes;baːtinaːma;nf;baːti-naːm-a;word;;ke;ke;do.cv;ke-ton ʥa-i asu baːti-naːm-a ke nori soʨ ke-mek ʨi karik bak-e ɬi fant tʰini tine ama pena fant fus ga-i;do-prf.3pl say-cv prox.obl.pl word-pl-obl do.cv now thinking do-prs.1pl that which side-erg/ins by path be.prs.3f.sg there we.obl from path lost go-cv;It was in this thought that they forgot the way to continue their journey.;18;;;;;;;;;;;;
20220124-SadaatVisitAkroiToArandugole;123;yes;baːti;nf;baːti;word;;kerok;ker-ok;do-pst.1pl;tasa manzi baːg-i law muxtalif qism-an-i baːti ker-ok tasa manzi zaŋgal-an-a baːraː laːm-an-a baːraː itifaːq-an-a baːraːː;dist.obl.sg with/at spend.the.night-cv very different kind-gen-f word do-pst.1pl dist.obl.sg with/at forest-gen-m about village-gen-m about faith/unity-gen-m about;After spending the night with him, we talked about various things about the forest, the village and unity.;18;;;;;;;;;;;;
20220409-RafeezUllahDarsolQuran;32;yes;baːti;nf;baːti;word;;kewaːn;ke-waːn;do-pass;ama pakaːr tʰana ʨi har maːnuʂ-ãː ki tasan-i zubaːn-e baːti ke-waːn ga ba se zar parz-imaːn;we.obl necessity be.prs.3m.sg that every man-dat to dist.gen.sg-f language-erg/ins word do-pass go.pst.3sg irr dist.sg quickly understand-prs.3sg;We should teach in our mother tongue so that he can understand easily;18;;;;;;;;;;;;
20220506-HamasAfghanAtArandu;8;yes;baːti;nf;baːti;word;;kera;ker-a;do-imp.sg;faːr-i ɕil-i haːlaːt bui te ɕil-i bui te rataj amãː ki ja du ɬe mineʈ baːti ker-a;such-f situation be.pst.3f.sg here such-f be.pst.3f.sg here on we.dat to indf two three minute word do-imp.sg;What are your conditions there? How do you see the situation here? shed light on it.;18;;;;;;;;;;;;
20220706-AbdulMananTellingFolkTale[2];47;yes;baːti;nf;baːti;word;;kemes;ke-mes;do-prs.2sg;giri boʈai-an-i zent-i ʥa-us ʨi katal-i katal-i baːti ke-mes;then Botai-gen-cv snake-erg/ins say-pst.3sg that big(?)-f big(?)-f word do-prs.2sg;After hearing these words, Botai's heart snake started saying that you are talking big;18;;;;;;;;;;;;
20220718-RahmatUllahServices;28;yes;baːti;nf;baːti;word;;kerum;ker-um;do-pst.1sg;tasa manzi baːti ker-um;dist.obl.sg with/at word do-pst.1sg;I spoke with them;18;;;;;;;;;;;;
20220718-RahmatUllahServices;29;yes;baːti;nf;baːti;word;;kerum;ker-um;do-pst.1sg;asisʈanʈ kamiɕnar e si saːhib-a manzi baːti ker-um tine d-i;assistant commissioner Sir-obl with/at word do-pst.1sg there go-cv;I had a talk with Mr. AC [Assitant Commissioner];18;;;;;;;;;;;;
20220718-RahmatUllahServices;35;yes;baːti;nf;baːti;word;;kerum;ker-um;do-pst.1sg;tasa manzi muj baːti ker-um;dist.obl.sg with/at I.erg word do-pst.1sg;I consulted with them;18;;;;;;;;;;;;
20220718-RahmatUllahServices;58;yes;baːti;nf;baːti;word;;kerum;ker-um;do-pst.1sg;giri muj soʨ ker-um giri asu kasaːn-a manzi baːti ker-um;then I.erg thinking do-pst.1sg then prox.obl.pl people-obl with/at word do-pst.1sg;Then I thought someone spoke to me;18;;;;;;;;;;;;
20220718-RahmatUllahServices;99;yes;baːti;nf;baːti;word;;keidaːum;ke-idaːum;do-dist.pst.1sg;asa kasaːn-a manzi baːti ke-idaːum;prox.obl.sg people-obl with/at word do-dist.pst.1sg;I had a talk with these people;18;;;;;;;;;;;;
20220718-RahmatUllahServices;164;yes;baːti;nf;baːti;word;;kei;ke-i;do-cv;asa manzi baːti ke-i haranu-a ʂaʦi bas;prox.obl.sg with/at word do-cv Arandu-obl for okay;I will talk to him about Arundu.;18;;;;;;;;;;;;
20221009-InamullahCuttingfruit;13;yes;baːti;nf;baːti;word;;kewa;ke-wa;do-imp.pl;ajaː te ʈʰaːn-a niʂ-i baːti ke-wa bajaː;come dist.obl.sg area-obl sit-cv word do-imp.pl brother;Please sit down here and talk;18;;;;;;;;;;;;
20221009-InamullahCuttingfruit;17;yes;baːti;nf;baːti;word;;kewa;ke-wa;do-imp.pl;hãː baːti ke-wa;yes word do-imp.pl;now talk;18;;;;;;;;;;;;
20221009-MuhibUllahWatchingBee;9;yes;baːti;nf;baːti;word;;keriba;ker-iba;do-fut.3sg;tasan-a mutaːliq baːti ker-iba;dist.gen.sg-m concerning word do-fut.3sg;He will talk about it.;18;;;;;;;;;;;;
20221015-GholamMalakCuttingMeat;16;yes;baːti;nf;baːti;word;;kewa;ke-wa;do-imp.pl;jafala zori zori baːti ke-wa xaː;some louder louder word do-imp.pl ok;None;18;;;;;;;;;;;;
20221015-GholamMalakCuttingMeat;34;yes;baːti;nf;baːti;word;;kewa;ke-wa;do-imp.pl;jafala sa band ke baːti ke-wa;some prox.obl.sg closed do.cv word do-imp.pl;Stop your work and talk;18;;;;;;;;;;;;
20221030-HizbullahTellingAboutAGame;50;yes;baːti;nf;baːti;word;;kera;ker-a;do-imp.sg;te baːraː baːti ker-a;dist.obl.sg about word do-imp.sg;Tell about this;18;;;;;;;;;;;;
20221030-HizbullahTellingAboutAGame;97;yes;baːti;nf;baːti;word;;kewa;ke-wa;do-imp.pl;woj ki azaːd azaːd baːti ke-wa;prox.sg quick(?) quick(?) word do-imp.pl;Tell quickly;18;;;;;;;;;;;;
