text_title;sentence_number;include;preceding_word;preceding_word_pos;preceding_word_morph;preceding_word_gls;borrowing;verb;verb_morph;verb_gls;sentence;sentence_gls;sentence_trsl;semantic_field;;;;;;;;;;;;
20220909-InamullahNarrationAboutRamRam;59;no;wagila;nm;wagila;thing;;kemet;ke-met;do-prs.3pl;leɬ-ik-e baːd tasa ʂuka-i ʥanɬ-ãː gaː-ji tanu wagila ke-met;harvest-vn-erg/ins after dist.obl.sg dry.caus-cv water.mill-dat carry-cv self's thing do-prs.3pl;Then they take the produce to the mills;;;;;;;;;;;;;
20221009-AbulHassanCuttingMaize;28;no;ʨal;nm;ʨal;thing;;kejt;ke-jt;do-pst.3pl;awal aman-a baːp gila ɕiki ʨal ke-jt ʨi;first our-m father pl so thing do-pst.3pl that;Earlier our ancestors used to do it like this;;;;;;;;;;;;;
20221009-InamullahCuttingfruit;11;no;igila;n;i-gila;thing;;kerikana;ker-ik-an-a;do-vn-gen-m;ker-i tasa i-gila ker-ik-an-a tareqa kaːr ki tʰana;do-cv dist.obl.sg thing do-vn-gen-m way be.prs.3m.sg;Regarding Amlok [persimon], let's ask him about this process.;;;;;;;;;;;;;
20221009-MuhibUllahWatchingBee;19;no;igila;n;i-gila;thing;;kemet;ke-met;do-prs.3pl;ʦur kaːl-apaːɬena ime te ɖer-a tala-i i-gila te i-gila ke-met;four year-obl-since prox.pl dist.obl.sg obl put-cv thing dist.obl.sg thing do-prs.3pl;They have been camping in it for four years;;;;;;;;;;;;;
20221009-MuhibUllahWatchingBee;22;no;gila;n;gila;thing;;keon;ke-on;do-pst.3pl;gila ke-on ba asa ʐu-ik-a ʂaʦi bi istimaːl ke woj law ɕafaː ɕai tʰini parz-os-aː;thing do-pst.3pl irr prox.obl.sg eat-vn-obl for add use do.cv prox.sg very healing thing be.prs.3f.sg understand-pst.2sg-q;There is healing in honey in eating it;;;;;;;;;;;;;
20221009-MuhibUllahWatchingBee;28;no;gila;n;gila;thing;;keikani;ke-ik-an-i;do-vn-gen-f;ʦʰin-i gila ke-ik-an-i;cut-cv thing do-vn-gen-f;Cut it out;;;;;;;;;;;;;
20221009-MuhibUllahWatchingBee;47;no;gila;n;gila;thing;;kei;ke-i;do-cv;gila ke-i;thing do-cv;It is so;;;;;;;;;;;;;
20221009-MuhibUllahWatchingBee;48;no;gila;n;gila;thing;;ketonãː;ke-ton-ãː;do-prf.3pl-dat;tasa anɬuka asũi gila ke-ton-ãː tine pana;dist.obl.sg prox.erg.pl thing do-prf.3pl-dat that.obl from;They have drunk his tears;;;;;;;;;;;;;
20221009-MuhibUllahWatchingBee;49;no;gila;n;gila;thing;;ketus;ke-tus;do-prf.3sg;allah paːk-e asa jak gila ke-tus;God clean-erg/ins prox.obl.sg one thing do-prf.3sg;Allah has declared it as healing;;;;;;;;;;;;;
20221009-MuhibUllahWatchingBee;58;no;gila;n;gila;thing;;keikani;ke-ik-an-i;do-vn-gen-f;asa gila ke-ik-an-i istimaːl ke-ik-an-i;prox.obl.sg thing do-vn-gen-f use do-vn-gen-f;We will use it;;;;;;;;;;;;;
20221009-MuhibUllahWatchingBee;59;no;gila;n;gila;thing;;kemet;ke-met;do-prs.3pl;asa tofa-a ʂaʦi bi gila ke-met;prox.obl.sg gift-obl for add thing do-prs.3pl;It is also given as gifts;;;;;;;;;;;;;
20221009-MuhibUllahWatchingBee;66;no;gila;n;gila;thing;;ketus;ke-tus;do-prf.3sg;allah paːk-e asan-a law ɖal aham gila ke-tus parz-os-aː bemaːri-a ʂaʦi;God clean-erg/ins prox.gen.sg-m very big important thing do-prf.3sg understand-pst.2sg-q decease-obl for;Allah has given him a good cure;;;;;;;;;;;;;
20221009-MuhibUllahWatchingBee;85;no;gila;n;gila;thing;;keu;ke-u;do-pst.2sg;te ka asu loʈa-i gila ke-u ba;dist.obl.sg prox.obl.pl check-cv thing do-pst.2sg irr;When checking them;;;;;;;;;;;;;
20221009-MuhibUllahWatchingBee;89;no;gila;n;gila;thing;;keron;ker-on;do-pst.3pl;parz-os-aː gila ker-on ba;understand-pst.2sg-q thing do-pst.3pl irr;This is also done;;;;;;;;;;;;;
20221015-GholamMalakCuttingMeat;47;no;ɕai;nm;ɕai;thing;Psh;kemet;ke-met;do-prs.3pl;xaː ki ʈem-a muʂʈi tajaːr b-imaːn kara ki ɕai ke-met asa ʥaː niaː;so what time-obl food ready be-prs.3sg who what thing do-prs.3pl prox.obl.sg say.imp;So how long will the food be ready?;;;;;;;;;;;;;
20221015-GholamMalakCuttingMeat;72;no;ɕai;nm;ɕai;thing;Psh;kemet;ke-met;do-prs.3pl;ime ki ɕai ke-met a-traːnti kiki ki ɬam ke-met tasan-a baːraː ʥa-a;prox.pl what thing do-prs.3pl inside what-what what work do-prs.3pl dist.gen.sg-m about say-imp.sg;Tell us about what they do inside;;;;;;;;;;;;;
20221015-GholamMalakCuttingMeat;75;no;ɕai;nm;ɕai;thing;Psh;kemet;ke-met;do-prs.3pl;purugraːm-a manzi taːnu-ãː au ja ɕai waːri ɕai ke-met;program-obl with/at self's-dat and indf thing besides thing do-prs.3pl;Different things tell each other;;;;;;;;;;;;;
20221015-GholamRazaqTellingFolkTale;14;no;gila;n;gila;thing;;kejet;ke-jet;do-pst.3pl;tasa maːnuʂ-a laka time laːm-an-a xalaq laka gila ke-jet faːʈʂaː-a ʐupa-at;dist.obl.sg man-obl like dist.pl village-gen-m people like thing do-pst.3pl king-obl make-pst.3pl;The people of this village used to make their own king;;;;;;;;;;;;;
20221015-GholamRazaqTellingFolkTale;69;no;gila;n;gila;thing;;ketitãː;ke-tita-ãː;do-fut.3pl-dat;time tinena tasa ʥaːnwar-a maːr-itit-ãː tinena tasa gila-a gila ke-tita-ãː;dist.pl from.there dist.obl.sg animal-obl kill-subj.3pl-dat from.there dist.obl.sg thing-obl thing do-fut.3pl-dat;They too could plan their future;;;;;;;;;;;;;
20221030-HizbullahTellingAboutAGame;11;no;ɕai;nm;ɕai;thing;Psh;kerimaːniu;ker-imaːniu;do-prs.2pl;xaː ʥ-a baten woj te ki ɕai ker-imaːniu pudam ma ʥ-es;come-imp.sg please prox.sg here what thing do-prs.2pl forward don't come-pst.2sg;Well, tell me what you're doing here;;;;;;;;;;;;;
20221030-HizbullahTellingAboutAGame;59;no;gila;n;gila;thing;;kewa;ke-wa;do-imp.pl;woj gila ke-wa;prox.sg thing do-imp.pl;Tell us;;;;;;;;;;;;;
20221030-MuhibUllahAboutFarming;28;no;gila;n;gila;thing;;keik;ke-ik;do-pst.1pl;gadaː-naːm-a ter girai au parz-os-aː ama gila ke-ik;donkey-pl-obl passing then and understand-pst.2sg-q we thing do-pst.1pl;So we used to do this work with the help of these pets;;;;;;;;;;;;;
20221030-MuhibUllahAboutFarming;39;no;gila;n;gila;thing;;kemaːn;ke-maːn;do-prs.3sg;gom tala-i giri toli woj ʈaktar toli tasa tʰrɕar ke-maːn gila ke-maːn goit ke-maːn;wheat put-cv then when prox.sg tractor dist.obl.sg thresher do-prs.3sg thing do-prs.3sg plough do-prs.3sg;The tractor then plows into it;;;;;;;;;;;;;
20221030-MuhibUllahAboutFarming;43;no;gila;n;gila;thing;;ke;ke;do.cv;iʂʈau ʥa-met parz-os-aː ɖanɖ ke hiraːi-i ke tasa gila ke uʂʈa-mek;planting say-prs.3pl understand-pst.2sg-q lake do.cv mud do.cv dist.obl.sg thing do.cv sow-prs.1pl;There is a different method of paddy cultivation for which the field is irrigated with water;;;;;;;;;;;;;
20221030-MuhibUllahAboutFarming;56;no;gila;n;gila;thing;;kemet;ke-met;do-prs.3pl;karik bi ʈekʈar ʥ-imet roɖ-ãː ki kʰaː-i tasu tine maːɕin-e ɬi parz-os-aː gila ke-met;which add tractor come-prs.3pl road-dat to take.out-cv dist.obl.pl there machine-erg/ins by understand-pst.2sg-q thing do-prs.3pl;Any machine that comes in the road has to be cleaned;;;;;;;;;;;;;
20221113-AbdulMananTellingLocalSports;25;no;ɕai;nm;ɕai;thing;Psh;kerimet;ker-imet;do-prs.3pl;ime nikanika ʥ-i nori te kirkaʈ ke-met kara ja ɕai ker-imet kara waːri ɕai ker-imet;prox.pl children come-cv now here cricket do-prs.3pl some indf thing do-prs.3pl some other thing do-prs.3pl;These children come here and play cricket or other games;;;;;;;;;;;;;
20221113-AbdulMananTellingLocalSports;25;no;ɕai;nm;ɕai;thing;Psh;kerimet;ker-imet;do-prs.3pl;ime nikanika ʥ-i nori te kirkaʈ ke-met kara ja ɕai ker-imet kara waːri ɕai ker-imet;prox.pl children come-cv now here cricket do-prs.3pl some indf thing do-prs.3pl some other thing do-prs.3pl;These children come here and play cricket or other games;;;;;;;;;;;;;
20221113-AbdulMananTellingLocalSports;68;no;ɕai;nm;ɕai;thing;Psh;kemet;ke-met;do-prs.3pl;laka nun sobaːra ime karik kirkaʈ ke-met kara ja ɕai ke-met waːri ɕai ke-met;like today nowadays prox.pl which cricket do-prs.3pl some indf thing do-prs.3pl other thing do-prs.3pl;These are the modern games of today;;;;;;;;;;;;;
20221113-AbdulMananTellingLocalSports;68;no;ɕai;nm;ɕai;thing;Psh;kemet;ke-met;do-prs.3pl;laka nun sobaːra ime karik kirkaʈ ke-met kara ja ɕai ke-met waːri ɕai ke-met;like today nowadays prox.pl which cricket do-prs.3pl some indf thing do-prs.3pl other thing do-prs.3pl;These are the modern games of today;;;;;;;;;;;;;
20230111-AhsanUllahDriver;8;no;gila;n;gila;thing;;kera;ker-a;do-imp.sg;xaː awal taːnu gaːɽai-a duwa-ik-an-a gila ker-a;so first self's car-obl wash-vn-gen-m thing do-imp.sg;well tell us about the cleaning of your car;;;;;;;;;;;;;
20230111-AmirWaliShahAtMedicalStor;84;no;wagila;nm;wagila;thing;;ke;ke;do.cv;kark-an-i taklif-aːt-a wagila ke wuʈa-mek naj;someone-gen-f trouble-pl-m thing do.cv stand.caus-prs.1pl no;but we also know the hardships of people;;;;;;;;;;;;;
20230111-BahramKhanMasjedMolve;141;no;gila;n;gila;thing;;kem;ke-m;do-pst.1sg;tu ʥa-a rai tãː ki ɕai gila ke-m kol ki ʈem-a ʥ-imet;you.sg say-imp.sg you.sg.dat what thing thing do-pst.1sg when what time-obl come-prs.3pl;??;;;;;;;;;;;;;
20230111-IjazUllahTeachingAtIPS;35;no;ɕai;nm;ɕai;thing;Psh;kemaːn;ke-maːn;do-prs.3sg;woj ki ɕai ke-maːn ba asu taːnu manzi bum manzi ʥazub b-imaːn najaː;prox.sg what thing do-prs.3sg prox.obl.pl self's with/at earth with/at absorbing be-prs.3sg;it absorbs the water from the soil;;;;;;;;;;;;;
20230111-IjazUllahTeachingAtIPS;36;no;ɕai;nm;ɕai;thing;Psh;kemaːn;ke-maːn;do-prs.3sg;ʥazab b-ik e baːd karik tʰana ba zaːilem karik tʰana ba se ki ɕai ke-maːn;absorbing be-vn erg/ins after which be.prs.3m.sg xylem which be.prs.3m.sg dist.sg what thing do-prs.3sg;after absorbing xylem do that;;;;;;;;;;;;;
20230111-IjazUllahTeachingAtIPS;38;no;ɕai;nm;ɕai;thing;Psh;kemaːn;ke-maːn;do-prs.3sg;asan-a faʈa woj mewa daːm-imaːn jaː woj ʂaːŋka san-i was kata b-imaːn sãː ki ɕai ke-maːn woj;prox.gen.sg-m leaf prox.sg fruit hold-prs.3sg or prox.sg branch f how.many be-prs.3sg prox.dat.sg what thing do-prs.3sg prox.sg;it plays role in the leaves and the fruit on the branches;;;;;;;;;;;;;
20230111-IjazUllahTeachingAtIPS;41.2;no;ɕai;nm;ɕai;thing;Psh;kemaːn;ke-maːn;do-prs.3sg;ki ɕai ke-maːn ba asa xuraːk -a;what thing do-prs.3sg prox.obl.sg food obl;what does it do, it gives food;;;;;;;;;;;;;
20230111-IjazUllahTeachingAtIPS;43;no;ɕai;nm;ɕai;thing;Psh;kemaːn;ke-maːn;do-prs.3sg;en ganɖa e ɬi ki ɕai ke-maːn ba;prox.erg/ins stem erg/ins by what thing do-prs.3sg;that is done by that stem;;;;;;;;;;;;;
20230111-IjazUllahTeachingAtIPS;46;no;ɕai;nm;ɕai;thing;Psh;kemaːn;ke-maːn;do-prs.3sg;nori ja ʂaːŋkoli tʰini niaː muʈʰa-an-i se ʂaːŋkoli ki ɕai ke-maːn;now indf small.branch(?) be.prs.3f.sg tree-gen-f dist.sg small.branch(?) what thing do-prs.3sg;the small branches of a tree, what does it do?;;;;;;;;;;;;;
20230111-IjazUllahTeachingAtIPS;47.2;no;ɕai;nm;ɕai;thing;Psh;kemaːn;ke-maːn;do-prs.3sg;giri faʈa-naːm -a ki ɕai ke-maːn ba;then leaf-pl obl what thing do-prs.3sg;leaves grow on it;;;;;;;;;;;;;
20230111-IjazUllahTeachingAtIPS;50;no;ɕai;nm;ɕai;thing;Psh;kemaːn;ke-maːn;do-prs.3sg;au felem karik tʰana asu xuraːk-naːm-a ki ɕai ke-maːn ba en daːm-i ɕiki gaiʥi ki ɕai ke-maːn asãː feda-maːn;and phloem which be.prs.3m.sg prox.obl.pl food-pl-obl what thing do-prs.3sg prox.erg/ins hold-cv so what thing do-prs.3sg prox.dat.sg convey-prs.3sg;responsibility of phloem is to bring the food here;;;;;;;;;;;;;
20230111-IjazUllahTeachingAtIPS;50;no;ɕai;nm;ɕai;thing;Psh;kemaːn;ke-maːn;do-prs.3sg;au felem karik tʰana asu xuraːk-naːm-a ki ɕai ke-maːn ba en daːm-i ɕiki gaiʥi ki ɕai ke-maːn asãː feda-maːn;and phloem which be.prs.3m.sg prox.obl.pl food-pl-obl what thing do-prs.3sg prox.erg/ins hold-cv so what thing do-prs.3sg prox.dat.sg convey-prs.3sg;responsibility of phloem is to bring the food here;;;;;;;;;;;;;
20230111-IjazUllahTeachingAtIPS;69;no;ɕai;nm;ɕai;thing;Psh;keru;ker-u;do-pst.2sg;woj muʈʰa ki ɕai ker-u ba ɖal b-imen d-imaːn;prox.sg tree what thing do-pst.2sg big be-ptcp.ipf go-prs.3sg;plant grows;;;;;;;;;;;;;
20230111-IjazUllahTeachingAtIPS;142;no;ɕai;nm;ɕai;thing;Psh;kerimaːn;ker-imaːn;do-prs.3sg;ime guʂa-naːm karik tʰanet ba woj ki ɕai ker-imaːn ba;prox.pl spore-pl which be.prs.3pl prox.sg what thing do-prs.3sg;these spores do that;;;;;;;;;;;;;
20230111-IjazUllahTeachingAtIPS;144;no;ɕai;nm;ɕai;thing;Psh;kemaːn;ke-maːn;do-prs.3sg;muʈʰa buaba ki ɕai ke-maːn ba;tree be.pst.3m.sg what thing do-prs.3sg;what they perform is;;;;;;;;;;;;;
20230111-IjazUllahTeachingAtIPS;145;no;ɕai;nm;ɕai;thing;Psh;kemaːn;ke-maːn;do-prs.3sg;woj tasa duɽa-naːm-a ki ɕai ke-maːn ba wuʈa-maːn;prox.sg dist.obl.sg dust-pl-obl what thing do-prs.3sg stand.caus-prs.3sg;that spoers collect the dust inside them;;;;;;;;;;;;;
20230111-IjazUllahTeachingAtIPS;154;no;ɕai;nm;ɕai;thing;Psh;kemet;ke-met;do-prs.3pl;ʈuwarisʈ karik tʰanet ba tasa alaːqa-an-i bagran ki ɕai ke-met ba ʥ-imet;tourist which be.prs.3pl dist.obl.sg area-gen-f towards what thing do-prs.3pl come-prs.3pl;the tourist come towards places like this;;;;;;;;;;;;;
20230111-IjazUllahTeachingAtIPS;191;no;ɕai;nm;ɕai;thing;Psh;keta;ke-ta;do-fut.3pl;kʰulaːu bi giri ɕil-a b-iba ze pudam d-i ki ɕai ke-ta taraqi ke-ta;opened add then such-m be-fut.3sg comp forward go-cv what thing do-fut.3pl development do-fut.3pl;they can move on to development;;;;;;;;;;;;;
20230111-IjazUllahTeachingAtIPS;221;no;ɕai;nm;ɕai;thing;Psh;kemek;ke-mek;do-prs.1pl;tasa ama ki ɕai ke-mek ba nun sobaːra ama tasa taːnu istimaːl -a ki aːn-i ba-mek;dist.obl.sg we what thing do-prs.1pl today nowadays we dist.obl.sg self's use obl bring-cv can-prs.1pl;we can use these things nowadays;;;;;;;;;;;;;
20230111-IjazUllahTeachingAtIPS;222;no;ɕai;nm;ɕai;thing;Psh;kemaːn;ke-maːn;do-prs.3sg;ɕiki karik tʰana ba har baʨai karik tʰana ba tasa aːsaːni -e sara ki ɕai ke-maːn ba se hil-imaːn;so which be.prs.3m.sg every child which be.prs.3m.sg dist.obl.sg ease erg/ins with what thing do-prs.3sg dist.sg learn-prs.3sg;likewise every young and old can learn it easily;;;;;;;;;;;;;
20230111-PrincipleAbdulHadiAtIPS;58;no;gila;n;gila;thing;;ke;ke;do.cv;tu karik kitaːb -an-a gila ke e;you.sg which subject gen-m thing do.cv;which subject are you learning;;;;;;;;;;;;;
20230111-PrincipleAbdulHadiAtIPS;130;no;gila;n;gila;thing;;kedaːus;ke-daːus;do-dist.pst.3sg;te ama manzi law gila ke-daːus;here we.obl with/at very thing do-dist.pst.3sg;they favoured us very much;;;;;;;;;;;;;
20230112-NoorHassanTellingLifeStory;76;no;gila;n;gila;thing;;ke;ke;do.cv;tasuĩ gila ke mãː ʥa-on ʨi to boʥai -a ki tala-ika;dist.erg.pl thing do.cv I.dat say-pst.3pl that you.sg.obl sack obl put-fut.1pl;They told me that we will pack you in a sack and take you away;;;;;;;;;;;;;
20230112-NoorHassanTellingLifeStory;116;no;gila;n;gila;thing;;keokãː;ke-ok-ãː;do-pst.1pl-dat;tine giri ãː ɖiaːi bi tasa manzi wiza-a gila ke-ok-ãː ki;there then I friend add dist.obl.sg with/at visa-obl thing do-pst.1pl-dat to;so along with him i get visa for there;;;;;;;;;;;;;
20230112-NoorHassanTellingLifeStory;146;no;gila;n;gila;thing;;keika;ke-ika;do-fut.1pl;gila ke-ika ʥa-i mo pena patagiri gila ke-i;thing do-fut.1pl say-cv I.obl from back thing do-cv;They encouraged me back;;;;;;;;;;;;;
20230112-NoorHassanTellingLifeStory;146;no;gila;n;gila;thing;;kei;ke-i;do-cv;gila ke-ika ʥa-i mo pena patagiri gila ke-i;thing do-fut.1pl say-cv I.obl from back thing do-cv;They encouraged me back;;;;;;;;;;;;;
20230112-NoorHassanTellingLifeStory;176;no;gila;n;gila;thing;;kei;ke-i;do-cv;teki ʥu teni bi gila ke-i ama bi xafa ke-us;dist.erg.sg add thing do-cv we add sad do-pst.3sg;We were also saddened to hear this;;;;;;;;;;;;;
20230112-NoorHassanTellingLifeStory;201;no;gila;n;gila;thing;;kedaːus;ke-daːus;do-dist.pst.3sg;mon-a mumaː -e karik gila ke-daːus i inʈri ke ama laka sahulat -e a-traːnt ɬenʈʂa-idaːus e;my-m uncle erg/ins which thing do-dist.pst.3sg entry do.cv we like facilities erg/ins inside get.into.caus-dist.pst.3sg;uncle did our entries and we arrived comfortably;;;;;;;;;;;;;
20230112-NoorHassanTellingLifeStory;221;no;gila;n;gila;thing;;kei;ke-i;do-cv;taːnu taːnu i-skrin naːm-a hisaːb kitaːb tasu gila ke-i tinena d-i-i iarpoʈ -a naŋg-i;self's self's screen pl-obl counting book dist.obl.pl thing do-cv from.there go-cv airport obl get.off-cv;it had separate screens for each, from there we landed in an airport;;;;;;;;;;;;;
20230112-NoorHassanTellingLifeStory;224;no;ɕai;nm;ɕai;thing;Psh;ke;ke;do.cv;tol ama law ʈraːi ke ʈelifun -an-a jak ɕai waːri ɕai ke ʈelifun -an-a sim bi tine amaj;then we very try do.cv telephone gen-m one thing other thing do.cv telephone gen-m SIM add there we.erg;that time we tried to make a phone call, we didn't had any SIM;;;;;;;;;;;;;
20230112-NoorHassanTellingLifeStory;229;no;gila;n;gila;thing;;kemaːn;ke-maːn;do-ptcp.ipf;gila ke-maːn bua ʥu tasa safaː-i waːla manzi baːti ke taːnu-ãː sim ga-us;thing do-ptcp.ipf be.pst.3m.sg dist.obl.sg clean-nmlz people with/at word do.cv self's-dat SIM carry-pst.3sg;he talked with the sweeper and then got a mobile SIM from him for himself;;;;;;;;;;;;;
20230112-NoorHassanTellingLifeStory;239;no;gila;n;gila;thing;;keika;ke-ika;do-fut.1pl;te kaːnʈin -ãː d-i muj ʥa-um gila ke-ika waːri sim -an-a kʰuda-ika muj ʥa-um;dist.obl.sg canteen dat go-cv I.erg say-pst.1sg thing do-fut.1pl other SIM gen-m ask-fut.1pl I.erg say-pst.1sg;i told why not we ask for a sim in the canteen;;;;;;;;;;;;;
20230112-NoorHassanTellingLifeStory;261;no;gila;n;gila;thing;;ke;ke;do.cv;gila ke suluʈ ke amãː ki gila ke-t parz-os-aː ʨi ime karik laka fariqaːna gila aːjat ʥa-i;thing do.cv welcome do.cv we.dat to thing do-pst.3pl understand-pst.2sg-q that prox.pl which like thing come.pst.3pl say-cv;they looked at us respectfully and welcome us;;;;;;;;;;;;;
20230112-NoorHassanTellingLifeStory;261;no;gila;n;gila;thing;;ket;ke-t;do-pst.3pl;gila ke suluʈ ke amãː ki gila ke-t parz-os-aː ʨi ime karik laka fariqaːna gila aːjat ʥa-i;thing do.cv welcome do.cv we.dat to thing do-pst.3pl understand-pst.2sg-q that prox.pl which like thing come.pst.3pl say-cv;they looked at us respectfully and welcome us;;;;;;;;;;;;;
20230112-NoorHassanTellingLifeStory;263;no;gila;n;gila;thing;;kei;ke-i;do-cv;taːnu fuk -a gila ke-i na parza-ik-i patigiri gir-ik;self's obl thing do-cv not understand.caus-vn-erg/ins back turn-pst.1pl;without paying attention comes outside;;;;;;;;;;;;;
20230112-NoorHassanTellingLifeStory;287;no;gila;n;gila;thing;;kei;ke-i;do-cv;law prugraːm mrugraːm ke-daːon tasu gila ke-i;very program m-redupl do-dist.pst.3pl dist.obl.pl thing do-cv;they arranged good program;;;;;;;;;;;;;
20230112-NoorHassanTellingLifeStory;294;no;gila;n;gila;thing;;kei;ke-i;do-cv;gila ke-i pudam i kʰuda-us bos -a pena;thing do-cv forward erg/ins ask-pst.3sg boss obl from;the boss ask us;;;;;;;;;;;;;
20230112-NoorHassanTellingLifeStory;322;no;gila;n;gila;thing;;kera;ker-a;do-imp.sg;ten ɖakʈar -e ʥa-us asa gila ker-a;dist.erg.sg doctor erg/ins say-pst.3sg prox.obl.sg thing do-imp.sg;the doctor said do that;;;;;;;;;;;;;
20230112-NoorHassanTellingLifeStory;325;no;gila;n;gila;thing;;keiu;ke-iu;do-opt;asan-i ilaːʥ ke-iu jaː gila ke-iu ʥa-i law gila ke-us-ãː;prox.gen.sg-f treatment do-opt or thing do-opt say-cv many thing do-pst.3sg-dat;either do treatment or send him to pakistan;;;;;;;;;;;;;
20230112-NoorHassanTellingLifeStory;325;no;gila;n;gila;thing;;keusãː;ke-us-ãː;do-pst.3sg-dat;asan-i ilaːʥ ke-iu jaː gila ke-iu ʥa-i law gila ke-us-ãː;prox.gen.sg-f treatment do-opt or thing do-opt say-cv many thing do-pst.3sg-dat;either do treatment or send him to pakistan;;;;;;;;;;;;;
20230112-NoorHassanTellingLifeStory;332;no;gila;n;gila;thing;;kei;ke-i;do-cv;ja ɖiaːi kamra-a bua tasa manzi milaːu bi tine gila ke-i;indf friend room-obl be.pst.3m.sg dist.obl.sg with/at met add there thing do-cv;one of my friends was in the room;;;;;;;;;;;;;
20230112-NoorHassanTellingLifeStory;337;no;gila;n;gila;thing;;kei;ke-i;do-cv;mon-a bistara bi se ɖiaːi law gila ke-i beraːnt kʰaː-i suri -ãː tala-i patigiri gila ke-i;my-m blanket(?) add dist.sg friend very thing do-cv outside take.out-cv sun dat put-cv back thing do-cv;that my friend take too much care of me he also kept clean the mattress;;;;;;;;;;;;;
20230112-NoorHassanTellingLifeStory;337;no;gila;n;gila;thing;;kei;ke-i;do-cv;mon-a bistara bi se ɖiaːi law gila ke-i beraːnt kʰaː-i suri -ãː tala-i patigiri gila ke-i;my-m blanket(?) add dist.sg friend very thing do-cv outside take.out-cv sun dat put-cv back thing do-cv;that my friend take too much care of me he also kept clean the mattress;;;;;;;;;;;;;
20230112-NoorHassanTellingLifeStory;339;no;gila;n;gila;thing;;ket;ke-t;do-pst.3pl;time zannaːm bi law gila ke-t xidmat ke-t mon-i;dist.pl add very thing do-pst.3pl service do-pst.3pl my-f;they also take care of me;;;;;;;;;;;;;
20230113-SubhaUllahTalkingAboutHisBusiness;114;no;ɕai;nm;ɕai;thing;Psh;kei;ke-i;do-cv;laːm -an-a maːmila tʰina teki ki ɕai ke-i na ba-mek;village gen-m matter(?) be.prs.3m.sg any(thing) thing do-cv not can-prs.1pl;these are all the village matters;;;;;;;;;;;;;
20230113-SubhaUllahTalkingAboutHisBusiness;124;no;ɕai;nm;ɕai;thing;Psh;kei;ke-i;do-cv;bas te ʈem -a maːnuʂ a-au bas baj xuraːk baj woj ɕai ke-i;okay dist.obl.sg time obl man and okay good food good prox.sg thing do-cv;on that day the such food is needed;;;;;;;;;;;;;
20230114-FazalMolaKaTanoor;44;no;igila;n;i-gila;thing;;kera;ker-a;do-imp.sg;ɬam ke-m-en-i i-gila ker-a;work do-gen-f thing do-imp.sg;speak while doning the work;;;;;;;;;;;;;
20230215-AliNawazTreatmentWithPatient;88;no;wagila;nm;wagila;thing;;keru;ker-u;do-pst.2sg;wagila ker-u ba ton-a dant kol bi xaraːb na b-ita;thing do-pst.2sg irr your-m tooth when add bad not be-fut.3pl;in that way your teeth will not decay ever;;;;;;;;;;;;;
20230215-AliNawazTreatmentWithPatient;134;no;wagila;nm;wagila;thing;;keu;ke-u;do-pst.2sg;au dant -a tuĩ safaː-i wagila ke-u ba dant kiãː xaraːb b-imaːn;and tooth obl you.sg.erg clean-nmlz thing do-pst.2sg irr tooth why bad be-prs.3sg;if you clean your teeth why will they decay;;;;;;;;;;;;;
20230327-MuhammadAliShahTalkingAboutLemonGarden;46;no;ɕai;nm;ɕai;thing;Psh;kejemãː;ke-jema-ãː;do-fut.1sg-dat;asa leman baːɣ -a manzi waːri bi ki ɕil-a ɕai ke-jema-ãː zi;prox.obl.sg lemon garden obl with/at besides add such-m thing do-fut.1sg-dat comp;to do something along with this lemon garden;;;;;;;;;;;;;
20230327-MuhammadAliShahTalkingAboutLemonGarden;68;no;gila;n;gila;thing;;kemaːn;ke-maːn;do-ptcp.ipf;xalaq bi mo rataj law gila ke-maːn bot;people add I.obl on many thing do-ptcp.ipf be.pst.3pl;people were criticizing me also;;;;;;;;;;;;;
20230402-NadarShahBookKeeperAtArandu;13;no;wagila;nm;wagila;thing;;kemek;ke-mek;do-prs.1pl;ʂobaːn-a wagila ke-mek au kark-a xapa na ke-mek;beautiful-m thing do-prs.1pl and someone-obl sad not do-prs.1pl;we behave good and didn't rile anyone;;;;;;;;;;;;;
20230409-GulMuhammadTalkingAboutMeyaMosque;17;no;wagila;nm;wagila;thing;;kerus;ker-us;do-pst.3sg;wagila ker-us ʨi jaraː te woj te na inʦ-imek au te ʥimaːid -ãː ʥ-iu;thing do-pst.3sg that here prox.sg here not bear-prs.1pl and dist.obl.sg mosque dat come-imp.pl;and said that this mosque is small for the worshipers;;;;;;;;;;;;;
20230409-GulMuhammadTalkingAboutMeyaMosque;25;no;wagila;nm;wagila;thing;;kei;ke-i;do-cv;asa wagila ke-i xudaːi paːk -i raham ke-us;prox.obl.sg thing do-cv God clean erg/ins mercy do-pst.3sg;Allah had mercy on us;;;;;;;;;;;;;
20230409-GulMuhammadTalkingAboutMeyaMosque;40;no;wagula;nm;wagula;thing;;keus;ke-us;do-pst.3sg;wagula ke-us ba imdaːd ker-on ba law baj b-iba;thing do-pst.3sg irr do-pst.3pl irr very good be-fut.3sg;whoever help, will be good;;;;;;;;;;;;;
20230409-GulMuhammadTalkingAboutMeyaMosque;64;no;ɕai;nm;ɕai;thing;Psh;kemet;ke-met;do-prs.3pl;au wagila maːl a-traːnt ɬeʨ-imet pistik ke-met ja ɕai ke-met;and thing livestock inside get.into-prs.3pl pooping do-prs.3pl indf thing do-prs.3pl;animals get in and poop;;;;;;;;;;;;;
20230507-ConversationBetweenPrincipalAndATeacher;9;no;gila;n;gila;thing;;kemaːn;ke-maːn;do-ptcp.ipf;iɕu bot tasu gila ke-maːn bok tasu to manzi;issue be.pst.3pl dist.obl.pl thing do-ptcp.ipf be.pst.1pl dist.obl.pl you.sg.obl with/at;these problems have to resolve along with you;;;;;;;;;;;;;
20230507-ConversationBetweenPrincipalAndATeacher;15;no;gila;n;gila;thing;;ketus;ke-tus;do-prf.3sg;sa faːroq sar -I gila ke-tus;prox.obl.sg Farooq Sir erg/ins thing do-prf.3sg;Farooq Sahib has taken this;;;;;;;;;;;;;
20230507-ConversationBetweenPrincipalAndATeacher;26;no;igila;n;i-gila;thing;;ketus;ke-tus;do-prf.3sg;bi es -a bi en law ziaːt i-gila ke-tus au;Bs obl add prox.erg/ins very more thing do-prf.3sg and;has obtain BS in it also;;;;;;;;;;;;;
20230507-ConversationBetweenPrincipalAndATeacher;31;no;gila;n;gila;thing;;kei;ke-i;do-cv;eː sar asan-i law kamaːnɖ tʰini sar woj nika nika-a baj tareqa -I gila ke-i ba-maːn;Sir prox.gen.sg-f very command be.prs.3f.sg Sir prox.sg children-obl good way erg/ins thing do-cv can-prs.3sg;yes sir he is much experienced, he will take the students in his confidence better;;;;;;;;;;;;;
20230507-ConversationBetweenPrincipalAndATeacher;49;no;gila;n;gila;thing;;keron;ker-on;do-pst.3pl;ton-a baːraː law taːrif ʥ-ibui xalaq -e law gila ker-on maː ɕaː allah ãː law xoɕaːl bom;your-m about very praise come-dist.pst.3f.sg people erg/ins many thing do-pst.3pl what God has willed I very happy be.pst.1sg;Mashaallah I have heard your praise from people;;;;;;;;;;;;;
20230507-ConversationBetweenPrincipalAndATeacher;52;no;gila;n;gila;thing;;kejiau;ke-jiau;do-opt;allah gila ke-jiau;God thing do-opt;May Allah improve;;;;;;;;;;;;;
20230507-ConversationBetweenPrincipalAndATeacher;66;no;gila;n;gila;thing;;kemaːn;ke-maːn;do-prs.3sg;matlab baj tareq -e gila ke-maːn;meaning good way erg/ins thing do-prs.3sg;means he comes farely;;;;;;;;;;;;;
